lemma	pos	date	grouping	identifier	description	context	indexes_target_token	indexes_target_sentence	identifier_system	project	lang
наложение	NOUN	1992	1992-2016	1992-2016_наложение_2935		Воспрепятствование должностными лицами кредитной организации осуществлению функций временной администрации Воспрепятствование должностными лицами кредитной организации осуществлению функций временной администрации -- влечет наложение административного штрафа в размере от двадцати до тридцати минимальных размеров оплаты труда.	224:233	0:327	2935	rushifteval	ru
наложение	NOUN	1700	1700-1916	1700-1916_наложение_2936		Толико всякой изобретатель далеко отстоит от последователей, в совершенстве его превосходящих. содержит одно токмо известие о покорении Сибири и приведении жителей к Шерте, и о наложении на них ясака, то есть дани, в мягкой рухляди состоящей.	177:186	0:242	2936	rushifteval	ru
наложение	NOUN	1992	1992-2016	1992-2016_наложение_2937		"Это такая контаминация, наложение двух слов -- ""баррель"" и ""рельеф""."	24:33	0:68	2937	rushifteval	ru
наложение	NOUN	1700	1700-1916	1700-1916_наложение_2938		Некто уверяет, что от наложения сея пошлины двоякая для государства произойдет польза.	22:31	0:86	2938	rushifteval	ru
наложение	NOUN	1992	1992-2016	1992-2016_наложение_2939		При этом, невыполнение в установленный срок законного предписания антимонопольного органа влечет наложение административного штрафа на должностных лиц в размере от сорока до пятидесяти МРОТ; на юридических лиц -- от двух до пяти тысяч МРОТ.	97:106	0:240	2939	rushifteval	ru
наложение	NOUN	1700	1700-1916	1700-1916_наложение_2940		"""Собор"" дал знать об этом Кириллу, а так как он все-таки медлил отъездом, то 10 марта послана была ему грамота, в которой требовалось, чтоб он ""не отягощал более своим здесь беспотребным и даже опасным существованием для мирных христиан сей столицы, сейчас же с Сергием и Филаретом отправился обратно в Белую Криницу, с тем что за противозаконные, никак не терпимые церковью деяния он, с наложением запрещения от священнодействия, подлежит суду большого освященного собора""."	388:398	0:474	2940	rushifteval	ru
наложение	NOUN	1992	1992-2016	1992-2016_наложение_2941		Наложение штрафа не освобождает виновных лиц от обязанности устранения допущенных нарушений и возмещения причиненного ущерба.	0:9	0:125	2941	rushifteval	ru
наложение	NOUN	1700	1700-1916	1700-1916_наложение_2942		Он должен быть составлен немедленно по наложении взыскания, в первую свободную для того минуту.	39:48	0:95	2942	rushifteval	ru
наложение	NOUN	1992	1992-2016	1992-2016_наложение_2943		Учение об импозиции (наложении) имен по общей форме его явно не устраивало, поскольку оно базировалось на непрямом отношении между записанными или произнесенными словами через посредство некоей абстрактной сущности.	21:30	0:215	2943	rushifteval	ru
наложение	NOUN	1700	1700-1916	1700-1916_наложение_2944		Комиссия вошла с представлением о наложении запрещения на имение Мясниковых в обеспечение правильности поступления доходов казны в течение следующего десятилетия.	34:43	0:162	2944	rushifteval	ru
наложение	NOUN	1992	1992-2016	1992-2016_наложение_2945		"Если разделение между смыслоразличением и коммуникацией абсолютизировать, то оно может стать истоком ложных обобщений, что и происходит, по Лосеву, в случае сначала полного изъятия из логики коммуникативного момента -- это в рабочих целях не только допустимо, но и необходимо, -- а затем непосредственного наложения структур такой некоммуникативно рассмотренной логики на процессы реальности -- что, по Лосеву, уже недопустимо, ибо, ""пропуская"" априорную коммуникативность любого смысла, такая стратегия приводит к ложным обобщениям."	306:315	0:533	2945	rushifteval	ru
наложение	NOUN	1700	1700-1916	1700-1916_наложение_2946		"Богатеи не хотели брать на себя круговую поруку уплаты за них ""новых наложений""; кроме того, они жаловались, что за ""келейницами"" земля даром пропадает, а на миру недоимки растут."	69:78	0:179	2946	rushifteval	ru
наложение	NOUN	1992	1992-2016	1992-2016_наложение_2947		При нейтральном допущении как не всерьез, но все же допущении, а значит и предицировании выведена из действия, нейтрализована именно установка на прямую референцию, все остальные ноэтически-ноэматические аспекты актов сознания, их последовательности, сцепления, наложения и т. д. сохраняются.	262:271	0:292	2947	rushifteval	ru
наложение	NOUN	1700	1700-1916	1700-1916_наложение_2948		Шутка сказать: следствие о неправильном осуждении после того, что обвиненный был наказан плетьми с наложением клейм!	99:109	0:116	2948	rushifteval	ru
наложение	NOUN	1992	1992-2016	1992-2016_наложение_2949		По ходатайству истца о принятии мер по обеспечению иска арбитражный суд вынес определение о наложении ареста на принадлежащие ответчику ценные бумаги без указания наименования этих бумаг и их количества.	92:101	0:203	2949	rushifteval	ru
наложение	NOUN	1700	1700-1916	1700-1916_наложение_2950		Скоро, однако, царь допустил изъятия из запрещения носить бороду, но при наложении очень большой пени.	73:82	0:102	2950	rushifteval	ru
наложение	NOUN	1992	1992-2016	1992-2016_наложение_2951		в случае наложения ареста на денежные средства клиента, учитываемые на специальном брокерском счете, обращения на них взыскания по обязательствам клиента, брокер обязан предоставить информацию о наличии и сумме денежных средств клиента на специальном брокерском счете уполномоченному государственному органу или должностному лицу по его запросу.	9:18	0:345	2951	rushifteval	ru
наложение	NOUN	1700	1700-1916	1700-1916_наложение_2952		Для каждой шаровой оболочки внутри шара мы имеем наложение двух противоположных зарядов formula, что соответствует избытку объемного положительного заряда, распределенного в шаровой оболочке, объем которой formula; отсюда следует, что внутри шара положительный заряд имеет постоянную объемную плотность formula и удовлетворяет условию, что сумма поверхностного отрицательного и объемного положительного зарядов равна нулю.	49:58	0:422	2952	rushifteval	ru
наложение	NOUN	1992	1992-2016	1992-2016_наложение_2953		Следует иметь ввиду, что постановление о наложении штрафа должно быть утверждено старшим судебным приставом.	41:50	0:108	2953	rushifteval	ru
наложение	NOUN	1700	1700-1916	1700-1916_наложение_2954		С этих пор он закрывает свою торговлю и, превращаясь в странника, выдает себя за мессию и исцеляет многих наложением своей руки.	106:116	0:128	2954	rushifteval	ru
наложение	NOUN	1992	1992-2016	1992-2016_наложение_2955		Статья 9.8. Нарушение правил охраны электрических сетей напряжением свыше 1000 вольт Нарушение правил охраны электрических сетей напряжением свыше 1000 вольт, могущее вызвать или вызвавшее перерыв в обеспечении потребителей электрической энергией, -- влечет наложение административного штрафа на граждан в размере от пяти до десяти минимальных размеров оплаты труда; на должностных лиц -- от десяти до двадцати минимальных размеров оплаты труда; на юридических лиц -- от ста до двухсот минимальных размеров оплаты труда.	258:267	0:520	2955	rushifteval	ru
