lemma	pos	date	grouping	identifier	description	context	indexes_target_token	indexes_target_sentence
хор	NOUN	1918	1918-1990	1918-1990_хор_5932-15		И тут я оказался никуда не годным: преподавал по новой тогда методике Столпянского, по которой все буквы считались состоящими из частей круга с придатками и писались со счетом вслух; например, при писании буквы "О" хором пели: "раз, два, три, О", для буквы "А": "раз, два, три, раз, А".	215:220	0:286
хор	NOUN	1918	1918-1990	1918-1990_хор_5944-15		Ей случалось петь в хоре, но она никогда не вслушивалась, как звучит ее пение.	20:24	0:78
хор	NOUN	1918	1918-1990	1918-1990_хор_5946-15		Зал зааплодировал, входя в пантомиму, как греческий хор.	52:55	0:56
хор	NOUN	1918	1918-1990	1918-1990_хор_5938-15		Потом транслировалось народное гулянье на Красной площади, громовые оркестры и хоры.	79:83	0:84
хор	NOUN	1918	1918-1990	1918-1990_хор_5948-15		Из этого хора выделялась, однако, своим неистовством башня Эйфеля, которая заговорила в те дни также и на русском языке, очевидно, ища путей к сердцу русского народа.	9:13	0:166
хор	NOUN	1918	1918-1990	1918-1990_хор_5922-15		Подпевая хору, Крутиков следил за лицами крестьян.	9:13	0:50
хор	NOUN	1918	1918-1990	1918-1990_хор_5936-15		С другой стороны, его функции разделяет и архонт-царь: мы видим, как победитель-вожак-тотем выделил из себя несколько функций и как царь-жрец распался на архонта-царя, на хорэга и на водителя хора, которым уже сделался корифей.	171:177	0:227
хор	NOUN	1918	1918-1990	1918-1990_хор_5906-15		Слушаю, как три десятка женщин, разлученных со своими детьми, ничего не знающих о судьбе своих сирот, лирически поют так, точно покачивают ребенка: Начальник КВЧ (культурно-воспитательной части) похвалил их за слаженность хора.	222:226	0:227
хор	NOUN	1918	1918-1990	1918-1990_хор_5920-15		И вот я уже слышу нестройный распадающийся хор: Множество лиц слилось в одно дрожащее пятно.	43:46	0:92
хор	NOUN	1918	1918-1990	1918-1990_хор_5894-15		Насмотревшись, идут к Козутопову есть знаменитую солянку и слушать хор.	67:70	0:71
хор	NOUN	1918	1918-1990	1918-1990_хор_5896-15		И. Н. Скворцов воспитал в своем хоре много хороших певцов.	32:36	0:58
хор	NOUN	1918	1918-1990	1918-1990_хор_5934-15		Несколько актеров решили составить комический хор.	46:49	0:50
хор	NOUN	1918	1918-1990	1918-1990_хор_5898-15		Он так прекрасно поставил хор, что сделался любимцем русской эмиграции, участвовал в концертах с Шаляпиным и даже два раза был приглашен с хором в Америку, где имел большой успех.	26:29	0:179
хор	NOUN	1918	1918-1990	1918-1990_хор_5900-15		Места дневок, где члены стаи, собираясь после трудов, встречают каждого положенным по рангу ритуалом, "обнюхивают" новости, долго что-то обсуждают, даже поют хором, потом ложатся на отдых поодиночке или попарно.	158:163	0:211
хор	NOUN	1918	1918-1990	1918-1990_хор_5940-15		Студенты ломилися толпами там, заполняя проходы и хоры; прилипли к стене; был галдеж под колоннами: распорядитель в линейной перчатке, в зеленом мундирчике, с воротником золотым, -- прижимая шпажонку, показывал, где кому сесть; порасселись седые профессорши в первых рядах, в платьях скромных фасонов и колеров (с рябью) -- тетеркиных, коростелиных и рябчиковых: все -- такие индюшки, такие цесарки; ряды -- лепетливые; дамы -- почтенные; кто-то, кряхтя, костылял; поздоровался с Суперцовым, с Тарасевичем, Львом Александрычем, с Узвисом; маленький ростом Анучин с лицом лисовато-простецким, с лисичьими глазками, морща свой лобик, хватался за нос, проходя на эстраду, где груди крахмалом пропятились; но задержался с Олессерером.	50:54	0:730
хор	NOUN	1918	1918-1990	1918-1990_хор_5902-15		Пел иногда русский хор Т. И. Филиппова, синодальные певчие, митрополичий хор.	19:22	0:77
хор	NOUN	1918	1918-1990	1918-1990_хор_5942-15		Он служил сначала в церковном хоре, а потом в одном из загородных ресторанных хоров.	30:34	0:84
хор	NOUN	1918	1918-1990	1918-1990_хор_5904-15		Иначе говоря, ходил регент заводского хора и обучал "певучих ребят", а также чертежник, учивший нас черчению и рисованию.	38:42	0:121
хор	NOUN	1918	1918-1990	1918-1990_хор_5918-15		Спорили друг с дружкой о философии долго и путано, потом пели хором под аккомпанемент Пономарькова -- "Был у Христа-младенца сад".	62:67	0:130
хор	NOUN	1918	1918-1990	1918-1990_хор_5924-15		Хор родственников с его слов этот случай подтверждал.	0:3	0:53
хор	NOUN	1918	1918-1990	1918-1990_хор_5916-15		Я шел и дирижировал оркестром и хором в семь тысяч голосов, певших марш из "Веселых ребят", -- таким большим хором мне, по правде сказать, дирижировать еще не приходилось.	32:37	0:171
хор	NOUN	1918	1918-1990	1918-1990_хор_5914-15		По нескольку человек в очередь пропускали они ребят, у которых это называлось -- ставить на хор.	92:95	0:96
хор	NOUN	1918	1918-1990	1918-1990_хор_5926-15		Хор строем вывели на сцену, их было человек пятьдесят, стриженных, как один, под "нулевку", Серов шепнул мне хвастливо, что ни в одной школе я не найду такой массовости.	0:3	0:169
хор	NOUN	1918	1918-1990	1918-1990_хор_5910-15		Пока скажу: правый хор надо сохранить.	19:22	0:38
хор	NOUN	1918	1918-1990	1918-1990_хор_5912-15		Когда Корвин желал, чтоб нарядные барышни хора пели более минорно, он давящим жестом опускал руку к земле, и конец тяжелого носа его тоже опускался в ложбинку между могучими усами.	42:46	0:180
хор	NOUN	1918	1918-1990	1918-1990_хор_5928-15		Самый плотный из всего хора музыкант страшно надувал свои щеки, выдувая басовые ноты из огромной трубы, перекинутой через его плечо.	23:27	0:132
хор	NOUN	1918	1918-1990	1918-1990_хор_5908-15		Только уж когда мы вышли на берег, общий хор соловьев Ботика закрыл этот звук.	41:44	0:78
хор	NOUN	1918	1918-1990	1918-1990_хор_5892-15		В хоре Глинищевского храма я заметила высокого молодого человека, певшего рядом с Людмилой.	2:6	0:91
хор	NOUN	1918	1918-1990	1918-1990_хор_5930-15		Позади мартыновских хором роскошный сад с китайскими беседками, качелями и фонтаном.	20:25	0:84
хор	NOUN	1992	1992-2016	1992-2016_хор_5927-15		Малинин не любит телячьих нежностей и ночных клубов Александр Малинин когда-то жил в Свердловске и пел в Уральском народном хоре.	124:128	0:129
хор	NOUN	1992	1992-2016	1992-2016_хор_5931-15		Знаменитый трактирно-шуточный хор под управлением Москвина -- этого словами не расскажешь.	30:33	0:90
хор	NOUN	1992	1992-2016	1992-2016_хор_5937-15		Но таких, увы, было слишком мало, чтобы заглушить хор хулителей.	50:53	0:64
хор	NOUN	1992	1992-2016	1992-2016_хор_5929-15		Хор и оркестр Академии Санта Чечилия.	0:3	0:37
хор	NOUN	1992	1992-2016	1992-2016_хор_5925-15		Путник читал, как заклинание: А хор подхватывал: Так собирались мы отметить декабрьский юбилей многонационального государства.	32:35	0:126
хор	NOUN	1992	1992-2016	1992-2016_хор_5933-15		Но ничего, припомню потом любимым родственникам все свои страдания, когда хором запоют о втором ребенке.	74:79	0:104
хор	NOUN	1992	1992-2016	1992-2016_хор_5939-15		-- Он, -- сказали они хором.	22:27	0:28
хор	NOUN	1992	1992-2016	1992-2016_хор_5935-15		На открытии выставки Дунаевский дирижировал хором, исполнявшим его песню: "Славься, родина обильная, ты великая, всесильная". Б. Никифоров: "Живопись изобилия и радости".	44:49	0:170
хор	NOUN	1992	1992-2016	1992-2016_хор_5919-15		Апофеоз наступил, когда 35 девушек вынесли на стартовую прямую огромное звезднополосатое полотнище, а детский хор Индианаполиса увлажнил глаза собравшихся исполнением национального гимна.	110:113	0:187
хор	NOUN	1992	1992-2016	1992-2016_хор_5921-15		Кстати, мотивы этой коммунальности присутствуют и в последнем нашем спектакле "Московский хор" по пьесе Петрушевской.	90:93	0:117
хор	NOUN	1992	1992-2016	1992-2016_хор_5943-15		По его инициативе было создано несколько церковных хоров, выступавших с концертными программами в нашей стране и за рубежом.	51:56	0:124
хор	NOUN	1992	1992-2016	1992-2016_хор_5917-15		Хор, куда меня пригласили, выступал в кинотеатрах перед сеансами.	0:3	0:65
хор	NOUN	1992	1992-2016	1992-2016_хор_5915-15		Оба храма -- пятинефные с галереями и лестничными башнями, с обширными хорами, оба имеют многоглавые завершения.	71:77	0:112
хор	NOUN	1992	1992-2016	1992-2016_хор_5913-15		Ближайшую аналогию я вижу в том особом удовольствии, которое я получала, когда пела в хоре.	86:90	0:91
хор	NOUN	1992	1992-2016	1992-2016_хор_5911-15		Тут угадывается что-то очень дальнее: хор как молитва безличных женско-мужских божеств, молитва в самом древнем, еще дорелигиозном обличии: воскрешающее женское -- природа, эрос и смерть -- и земное мужское, выражающее муку перед лицом города и мира в надежде утешения.	38:41	0:269
хор	NOUN	1992	1992-2016	1992-2016_хор_5909-15		Исполняется хором солистов.	12:17	0:27
хор	NOUN	1992	1992-2016	1992-2016_хор_5907-15		Среди хором даже церковка была как репа -- бочкастенькая, с пузатенькими главками.	6:11	0:82
хор	NOUN	1992	1992-2016	1992-2016_хор_5905-15		После девяти месяцев лечения в военном госпитале в городе Боржоми будущий пастырь вернулся на родину, в Кемерово, где стал руководить церковным хором, а с 1947 года нес послушание в Киево-Печерской лавре -- вначале был делопроизводителем, а после монашеского пострига с именем Нифонт, в честь святителя Нифонта Печерского и Новгородского, состоявшегося 13 апреля 1949 года, в течение двенадцати лет -- регента хора.	144:149	0:415
хор	NOUN	1992	1992-2016	1992-2016_хор_5941-15		В хоре только рот открывал.	2:6	0:27
хор	NOUN	1992	1992-2016	1992-2016_хор_5903-15		Искренностью своего пения подкупили дети из польской деревни Лосинка (хор называется "Рамонка", лауреат в номинации -- церковные детские хоры), отлично пели церковную музыку студенты Гродненского музыкального училища (лауреат в номинации -- светские молодежные и юношеские хоры специальных учебных заведений), всех покорил духовно-православный хор инженерных войск вооруженных сил России Свято -- Смоленской Зосимовой пустыни (единственный и первый хор солдат, исполнивший кроме церковных песнопений музыкальную композицию "Чечня", посвященную подвигу и памяти солдата Жени Родионова, погибшего в Чечне).	70:73	0:604
хор	NOUN	1992	1992-2016	1992-2016_хор_5899-15		Мне до слез захотелось на тот экзамен -- увидеть сразу и мать, и Марину, и хор, и взволноваться вместе с ними.	75:78	0:110
хор	NOUN	1992	1992-2016	1992-2016_хор_5897-15		Когда хор Московской консерватории, где пел и я, репетировал "Здравицу" -- уже навстречу 70-летию вождя -- наш хормейстер профессор Василий Петрович Мухин умолял нас: "Пожалуйста, помягче пойте гаммы.	6:9	0:200
хор	NOUN	1992	1992-2016	1992-2016_хор_5895-15		-- Так и сможем! -- заверили братья хором.	36:41	0:42
хор	NOUN	1992	1992-2016	1992-2016_хор_5923-15		Тут хор, конечно, начинает громко выпевать: кто это! кто это!	4:7	0:61
хор	NOUN	1992	1992-2016	1992-2016_хор_5949-15		Весной тридцать девятого начальник тюрьмы "Кресты" и тюремный врач, искавший на моем теле следы побоев, хором пророчили мне свободу.	104:109	0:132
хор	NOUN	1992	1992-2016	1992-2016_хор_5947-15		Очень хорошо помню беременную учительницу по хору.	6:12	0:50
хор	NOUN	1992	1992-2016	1992-2016_хор_5945-15		Праздничная церемония началась с "Ё"-гимна в исполнении детского хора: "О, буква "Ё"!	65:69	0:85
хор	NOUN	1992	1992-2016	1992-2016_хор_5901-15		Отслужив в праздничные дни раннюю Литургию, он обязательно оставался, чтобы руководить хором или просто петь во время поздней Литургии, прочитать Апостол, еще чем-нибудь помочь служащим.	87:92	0:186
хор	NOUN	1992	1992-2016	1992-2016_хор_5893-15		-- Художественный руководитель Кубанского казачьего хора Виктор ЗАХАРЧЕНКО (1938).	52:56	0:82
