lemma	pos	date	grouping	identifier	description	context	indexes_target_token	indexes_target_sentence	identifier_system	project	lang
тачка	NOUN	1700	1700-1916	1700-1916_тачка_5166		Вы не можете себе представить, какое впечатление производит человек, прикованный к тачке.	83:88	0:89	5166	rushifteval	ru
тачка	NOUN	1918	1918-1990	1918-1990_тачка_5167		Актер медленно опустился на тачку и, уткнувшись в шляпу, заплакал.	28:33	0:66	5167	rushifteval	ru
тачка	NOUN	1700	1700-1916	1700-1916_тачка_5168		Эти несчастные существа часто сидят по 12 часов одни-одинехоньки в темноте, занятые лишь отпиранием и запиранием дверей для пропуска тачек; понятно, что они от этого чуть не превращаются в идиотов.	133:138	0:197	5168	rushifteval	ru
тачка	NOUN	1918	1918-1990	1918-1990_тачка_5169		"Вера почувствовала, как дрогнула их ""тачка"", и они поплыли от ""Сириуса""."	37:42	0:72	5169	rushifteval	ru
тачка	NOUN	1700	1700-1916	1700-1916_тачка_5170		И роются, роются, тачки таскают, копошатся серые, смирные, вдвое согнутые.	18:23	0:74	5170	rushifteval	ru
тачка	NOUN	1918	1918-1990	1918-1990_тачка_5171		Добровольцы из публики быстро нагрузили тачку доверху.	40:45	0:54	5171	rushifteval	ru
тачка	NOUN	1700	1700-1916	1700-1916_тачка_5172		Провезли на тачке кожаные мешки с почтой, и проследовали за ними вразвалку два обшарпанных почтальона.	12:17	0:102	5172	rushifteval	ru
тачка	NOUN	1918	1918-1990	1918-1990_тачка_5173		Вот! -- ловко выхватил он из тачки свой мешок.	29:34	0:46	5173	rushifteval	ru
тачка	NOUN	1700	1700-1916	1700-1916_тачка_5174		Брюхо побежало впереди -- выходило, будто катил его генерал перед собой на тачке.	75:80	0:81	5174	rushifteval	ru
тачка	NOUN	1918	1918-1990	1918-1990_тачка_5175		Всю жизнь О. М., как каторжник к тачке, был прикован к писательским организациям и без их санкции не получил ни единого кусочка хлеба.	33:38	0:134	5175	rushifteval	ru
тачка	NOUN	1700	1700-1916	1700-1916_тачка_5176		Навоз заготовляется ко времени набивки сообразно с числом рам и глубиною парника: для набивки каждой рамы в полутеплом парнике нужно 2 тачки навоза, а в раннем и полутеплице вдвое больше, а иногда даже и целый воз, т. е. 6--8 тачек.	135:140	0:232	5176	rushifteval	ru
тачка	NOUN	1918	1918-1990	1918-1990_тачка_5177		С тех пор эта тачка и сохранилась, хотя раз ее чуть не разгрызли злые собаки.	14:19	0:77	5177	rushifteval	ru
тачка	NOUN	1700	1700-1916	1700-1916_тачка_5178		"Среди всех кандальников Александровской тюрьмы Пащенко нашел себе только одного ""человека по душе"", такого же тачечника, то есть приговоренного к прикованью к тачке, как и он, -- Широколобова."	159:164	0:192	5178	rushifteval	ru
тачка	NOUN	1918	1918-1990	1918-1990_тачка_5179		"Тачку украл!"""	0:5	0:13	5179	rushifteval	ru
тачка	NOUN	1700	1700-1916	1700-1916_тачка_5180		Около каждой избушки, между четырьмя столбами, вокруг каждого столба ходят, погоняемые мальчишками, по четыре и по пяти лошадей, которые приводят своею ходьбою в движение два каменные круга, вделанные у стены в перекладину и приводящие, с своей стороны, в движение толчею, находящуюся в избе и имеющую вид молота, медленно, но грозно опускающегося в середину большой чаши, в которую сверху сыплют из тачек руду.	400:405	0:411	5180	rushifteval	ru
тачка	NOUN	1918	1918-1990	1918-1990_тачка_5181		Федя тут же сбегал за тачкой и напихал в нее мокрого сена.	22:28	0:58	5181	rushifteval	ru
тачка	NOUN	1700	1700-1916	1700-1916_тачка_5182		Дети провожают равнодушными глазами партию арестантов, закованных в кандалы; когда кандальные везут тачку с песком, то дети цепляются сзади и хохочут.	100:105	0:150	5182	rushifteval	ru
тачка	NOUN	1918	1918-1990	1918-1990_тачка_5183		Эй, Сталевар, эй, мальчик, -- ложитесь в тачку, да побыстрей!	41:46	0:61	5183	rushifteval	ru
тачка	NOUN	1700	1700-1916	1700-1916_тачка_5184		Рудоподъемщики вследствие продолжительного неестественного положения тела при работе обыкновенно страдают болями в поясничных мышцах, появлению которых еще благоприятствует утомительное таскание тяжелых тачек; кроме того, по словам Ремерца, они довольно часто подвергаются воспалениям суставов нижних конечностей.	203:208	0:313	5184	rushifteval	ru
тачка	NOUN	1918	1918-1990	1918-1990_тачка_5185		"Человеку баскетбольного роста, разумеется, неудобно пользоваться ""усредненной"" тачкой."	79:85	0:86	5185	rushifteval	ru
тачка	NOUN	1700	1700-1916	1700-1916_тачка_5186		Эти громадные отвалы и свалка верховика и перемывок, правильные квадраты глубоких выемок, где добывался золотоносный песок, бутара, приводимая в движение паровой машиной, новенькая контора на взгорье, а там, в глубине, дымки старательских огней, кучи свежего хвороста и движущиеся тачки рабочих -- все это было до того близкое, родное, кровное, что от немого восторга дух захватывало.	281:286	0:384	5186	rushifteval	ru
тачка	NOUN	1918	1918-1990	1918-1990_тачка_5187		Евреи двигались в гетто со всего города по крутым спускам, под железнодорожными мостами, толкая перед собой тачки и ведя за руку закутанных детей.	108:113	0:146	5187	rushifteval	ru
тачка	NOUN	1700	1700-1916	1700-1916_тачка_5188		Пазульский был приговорен в Одессе к 12 годам, 100 плетям и трем годам прикования к тачке.	84:89	0:90	5188	rushifteval	ru
тачка	NOUN	1918	1918-1990	1918-1990_тачка_5189		"Они с Верой выпорхнули из дверей ""тачки"" и поплыли в невесомости спортивного зала."	34:39	0:82	5189	rushifteval	ru
тачка	NOUN	1700	1700-1916	1700-1916_тачка_5190		Во время молитвы он поднялся и стоял, опираясь на свою тачку, охая, вздыхая, напоминая какой-то страдальческий призрак, при каждом движении звеневший цепями.	55:60	0:157	5190	rushifteval	ru
тачка	NOUN	1918	1918-1990	1918-1990_тачка_5191		Просто Афонька был старше на три года, он был из другого племени, он был из тех, таинственных и чумазых, что по-муравьиному суетились в громадных котлованах и взбегали по деревянным настилам на свежие кирпичные стены, толкая тачки с кирпичом и цементом, и брызги раствора растекались по их худым лицам и бумажным ватникам.	225:230	0:322	5191	rushifteval	ru
тачка	NOUN	1700	1700-1916	1700-1916_тачка_5192		Я видел недавно скульптуру, изображающую работника, уснувшего от усталости на своей тачке; кажется, что это художественное произведение, но в конце концов оно почти ничего не говорит.	84:89	0:183	5192	rushifteval	ru
тачка	NOUN	1918	1918-1990	1918-1990_тачка_5193		Получилась тачка.	11:16	0:17	5193	rushifteval	ru
тачка	NOUN	1700	1700-1916	1700-1916_тачка_5194		Но зато он и выпускает это мясо на шестнадцатичасовой работе с тачкой в тридцать пудов.	63:69	0:87	5194	rushifteval	ru
тачка	NOUN	1918	1918-1990	1918-1990_тачка_5195		А он продолжал на своей эстакаде крутиться и вертеться, грузить и разгружать, таскать, возить на тачках товар в разные лотки и палатки.	97:103	0:135	5195	rushifteval	ru
тачка	NOUN	1700	1700-1916	1700-1916_тачка_5196		Призреваемые решили вывезти на тачке главного виновника -- эконома Жукова, он же член ремесленной управы.	31:36	0:105	5196	rushifteval	ru
тачка	NOUN	1918	1918-1990	1918-1990_тачка_5197		Беженцы засыпали землёй воронки, подвозили на тачках песок, укладывали на полотно булыжник.	46:52	0:91	5197	rushifteval	ru
тачка	NOUN	1700	1700-1916	1700-1916_тачка_5198		Когда же гора начинает убывать и тая, как снег, расползается, и снова появляются с черными тачками черные люди, и в звонких тачках развозят куда-то последние черные куски, и на дворе, усыпанном седым песком, подымаются белые палатки, и в серых больничных халатах бродят стриженые землистые люди да мелькает красный крест белых сестер, это значит -- зима прошла, лето наступает -- весна.	91:98	0:386	5198	rushifteval	ru
тачка	NOUN	1918	1918-1990	1918-1990_тачка_5199		Молчание и тоска ночи убедили ее, что Джесси в саду нет, но еще раз обошла она кругом небольшой сад и остановилась у дерева, где наткнулась на упавшую тачку.	151:156	0:157	5199	rushifteval	ru
тачка	NOUN	1700	1700-1916	1700-1916_тачка_5200		Тут все переменилось; нас словно сразу перенесли из мирного уединения в шумное общество; оглушенные свистом машины, грохотом тачек, навьюченных чемоданами, быстрым говором с резким ударением на р, -- мы в первую минуту потеряли голову и сами начали суетиться без всякой надобности.	125:130	0:281	5200	rushifteval	ru
тачка	NOUN	1918	1918-1990	1918-1990_тачка_5201		Женщины на тачках везут картошку, капусту.	11:17	0:42	5201	rushifteval	ru
тачка	NOUN	1700	1700-1916	1700-1916_тачка_5202		Особенно интересовали нас с Сидором, с которым у меня было длинное совещание насчет поездки, перевозочные средства: повозки, тачки, упряжь.	125:130	0:139	5202	rushifteval	ru
тачка	NOUN	1918	1918-1990	1918-1990_тачка_5203		Второй снимок наверное вызовет невольную улыбку читателя при виде злосчастного фотографа ставшего жертвой широкоугольника в руках своего неопытного, или желавшего пошутить коллеги, а фотография человека с тачкой порождает тревогу за судьбу сооружений и обывателей того города, по улице которого шествует этот уродливый исполин.	205:211	0:327	5203	rushifteval	ru
тачка	NOUN	1700	1700-1916	1700-1916_тачка_5204		Куда бы ни шел арестант, -- он всюду везет за собой тачку.	52:57	0:58	5204	rushifteval	ru
тачка	NOUN	1918	1918-1990	1918-1990_тачка_5205		"И часть рабочих, из числа не успевших или не смогших эвакуироваться, каждое утро приходила на работу ""по восстановлению"" -- так называлась в официальных документах очистка захламленного двора: несколько десятков человек вяло слонялось по двору, перевозя с места на место в ручных деревянных тачках лом и мусор."	291:297	0:310	5205	rushifteval	ru
тачка	NOUN	1700	1700-1916	1700-1916_тачка_5206		Ребята, с тачками туда!..	10:17	0:25	5206	rushifteval	ru
тачка	NOUN	1918	1918-1990	1918-1990_тачка_5207		Скотник, насквозь напитанный запахом навозной жижи, тот самый, что не довез своей тачки, а пошел смеяться с мужиками, когда мужики еще добродушно покуривали на крыльцах людской -- вертел в руках терракотовую копию химеры: -- Ванька, гляди-ка!	82:87	0:242	5207	rushifteval	ru
тачка	NOUN	1700	1700-1916	1700-1916_тачка_5208		Перевернутый стул вполне заменил тачку.	33:38	0:39	5208	rushifteval	ru
тачка	NOUN	1918	1918-1990	1918-1990_тачка_5209		-- Днем, я думаю, некрасиво будет с тачкой пойти.	36:42	0:49	5209	rushifteval	ru
тачка	NOUN	1700	1700-1916	1700-1916_тачка_5210		Одни работали в угольных складах, доставляя к пристани тачки; многие грузили уголь на суда; другие выгружали угольные пароходы.	55:60	0:127	5210	rushifteval	ru
тачка	NOUN	1918	1918-1990	1918-1990_тачка_5211		"Только и слышалось: ""Валерка, туда, Валерка, сюда!"" Получалось, что работал я -- куда пошлют: убирал мусор, подавал кирпич, возил в тачке песок, таскал стекло."	132:137	0:159	5211	rushifteval	ru
тачка	NOUN	1700	1700-1916	1700-1916_тачка_5212		Лунин был прикован к тачке навсегда.	21:26	0:36	5212	rushifteval	ru
тачка	NOUN	1918	1918-1990	1918-1990_тачка_5213		"Научился я опрокидывать тачку, ""вываливать"" и ездить обратно по ""холостому"" трапу -- тачки колесом вперед, ручками вверх, чтоб руки отдыхали."	24:29	0:141	5213	rushifteval	ru
тачка	NOUN	1700	1700-1916	1700-1916_тачка_5214		Я смотрю на него и верю: мы были животными -- он будет человеком, мы были каторжниками, прикованными к тачкам, -- он будет свободен.	103:109	0:132	5214	rushifteval	ru
тачка	NOUN	1918	1918-1990	1918-1990_тачка_5215		Амосов тоже год катал тачку и хорошо запомнил роль блатарей в избиении пятьдесят восьмой статьи, когда блатари палками выбивали план из троцкистов и фашистов.	22:27	0:158	5215	rushifteval	ru
тачка	NOUN	1700	1700-1916	1700-1916_тачка_5216		-- Ишь с какими выдумал подъезжать лясами! -- отозвался другой, выворачивая тачку.	76:81	0:82	5216	rushifteval	ru
тачка	NOUN	1918	1918-1990	1918-1990_тачка_5217		Уцелевшие жители расползались по всей Украине с тачками, ручными тележками -- в городе был голод.	48:55	0:97	5217	rushifteval	ru
тачка	NOUN	1700	1700-1916	1700-1916_тачка_5218		Двое разворачивали сваи, один парень подходил к нему с тачкой и утаскивал к шахте землю.	55:61	0:88	5218	rushifteval	ru
тачка	NOUN	1918	1918-1990	1918-1990_тачка_5219		По всем направлениям ярко освещенного настила бегут фигуры с тачками.	61:68	0:69	5219	rushifteval	ru
тачка	NOUN	1700	1700-1916	1700-1916_тачка_5220		На Хитровом рынке давно промышляет нищенством средних лет мужчина с параличными ногами, ездивший на тачке при помощи рук.	100:105	0:121	5220	rushifteval	ru
тачка	NOUN	1918	1918-1990	1918-1990_тачка_5221		Для каждого рода груза имелся свой тип тачки: для кирпича -- в виде платформы, для песка и угля -- в виде ящиков.	39:44	0:113	5221	rushifteval	ru
тачка	NOUN	1700	1700-1916	1700-1916_тачка_5222		Вместо тачек служили те же люди: относили на спине сырую землю.	7:12	0:63	5222	rushifteval	ru
тачка	NOUN	1918	1918-1990	1918-1990_тачка_5223		"Кулак Королев резонно рассудив, что добытые нами тачки песка уже не окупят даже рваных ватных штанов и бурок ЧТЗ, в которые прииск обязан был бы обрядить нас завтра и ""сбагрил"" доходяг на Тембинку точно ""впритирку"" с концом сезона."	49:54	0:231	5223	rushifteval	ru
тачка	NOUN	1700	1700-1916	1700-1916_тачка_5224		В те дни работал я на заводе за сорок копеек подённо, таскал на плечах и возил тачкой разные тяжести -- чугун, шлак, кирпич -- и ненавидел это адово место со всей его грязью, рёвом, гомоном и мучительной телу жарой.	79:85	0:215	5224	rushifteval	ru
тачка	NOUN	1918	1918-1990	1918-1990_тачка_5225		Ищенко первый бросился к своей тачке.	31:36	0:37	5225	rushifteval	ru
