lemma	pos	date	grouping	identifier	description	context	indexes_target_token	indexes_target_sentence
благодарность	NOUN	1918	1918-1990	1918-1990_благодарность_915-14		Он заслуживал похвалы, утешения, благодарности.	33:46	0:47
благодарность	NOUN	1918	1918-1990	1918-1990_благодарность_897-14		При вручении архиерейского жезла митрополит Стефан приветствовал новопосвященного речью, на которую тот отвечал благодарностью за возведение его на высокую степень благодатного служения Церкви, причем особенно отметил участие в его хиротонии представителя Русской Православной Церкви впервые после снятия схизмы как "большое церковно-политическое событие для всех православных болгар" и особенно дорогое для него, поскольку "великая Русская Православная Церковь не только среди прочих Православных Церквей, но и вообще в мире оказалась самою благодатно активною, родившею и воспитавшею многих великих святых с первых дней основания до самого последнего времени.	112:126	0:661
благодарность	NOUN	1918	1918-1990	1918-1990_благодарность_857-14		Не переписываться и с благодарностью вспоминать, что не мешаем друг другу.	22:36	0:74
благодарность	NOUN	1918	1918-1990	1918-1990_благодарность_891-14		Пирошников уселся на беленькую табуреточку, взяв в руки рюмку, и, приподняв в знак благодарности и приветствия, осушил ее.	83:96	0:122
благодарность	NOUN	1918	1918-1990	1918-1990_благодарность_859-14		Мало нужно простолюдину ласки, чтобы душа облилась еще большею благодарностью.	63:77	0:78
благодарность	NOUN	1918	1918-1990	1918-1990_благодарность_881-14		-- Получим премию сами и купим на нее десяток глобусов, а Мериновой и Калинину объявим благодарность.	87:100	0:101
благодарность	NOUN	1918	1918-1990	1918-1990_благодарность_893-14		Мать с благодарностью провела рукой по щеке сына, тоже поняла, что он поступился своими принципами ради нее.	7:21	0:108
