lemma	pos	date	grouping	identifier	description	context	indexes_target_token	indexes_target_sentence
заблуждение	NOUN	1918	1918-1990	1918-1990_заблуждение_1829-14		К тем, -- добавил он, подумав, -- которые не упорствуют в своих заблуждениях.	64:76	0:77
заблуждение	NOUN	1918	1918-1990	1918-1990_заблуждение_1861-14		-- Пятнадцати -- удивился Люсин, почему-то считавший поиски философского камня заблуждением не столь древним.	79:91	0:109
заблуждение	NOUN	1918	1918-1990	1918-1990_заблуждение_1821-14		Кабы прославленный петербургский физиолог Пашутин не объявил исследования Льва Соболева на поджелудочной железе бесперспективными заблуждениями, то скорее всего Соболев, а не Фредерик Бантинг получил бы Нобелевскую премию за открытие инсулина.	130:143	0:243
заблуждение	NOUN	1918	1918-1990	1918-1990_заблуждение_1857-14		Ганьшин никогда не одобрял прошлых заблуждений и метаний своего друга, считал, что Бережкову не следует ничем отвлекаться от работы в институте авиационных моторов, от навсегда избранного прямого пути, но на этот раз в виде исключения все-таки решил помочь ему отвлечься.	35:46	0:271
заблуждение	NOUN	1918	1918-1990	1918-1990_заблуждение_1871-14		В нашем размышлении, в котором мы так же мало задаемся апологетическими тенденциями, как и тенденциями разрушительными, а лишь пытаемся непредвзято увидеть и описать правду во всей ее полноте, мы отнюдь не намерены "опровергать" неверие в его религиозно-метафизическом утверждении -- в смысле признания его простым "заблуждением".	316:328	0:330
