lemma	pos	date	grouping	identifier	description	context	indexes_target_token	indexes_target_sentence
углеводород	NOUN	1918	1918-1990	1918-1990_углеводород_5353-14		И поэтому выбрали в качестве растворителей насыщенные нормальные углеводороды.	65:77	0:78
углеводород	NOUN	1918	1918-1990	1918-1990_углеводород_5351-14		Одна -- нефть происходит из органического вещества в осадочных толщах земной коры, другая -- углеводороды синтезируются из неорганических веществ (карбонатов, СО2 и др.) на больших глубинах в мантии при температуре выше 1000C и давлении в десятки кбар.	93:105	0:252
углеводород	NOUN	1918	1918-1990	1918-1990_углеводород_5349-14		Зелинскому и его ученикам удалось стереть границы между различными классами углеводородов, которые до этого казались непереходными.	76:89	0:131
углеводород	NOUN	1918	1918-1990	1918-1990_углеводород_5347-14		В самом начале обширных исследований А. Е. Фаворского в области непредельных углеводородов и явлений изомеризации у него появились ученики.	77:90	0:139
углеводород	NOUN	1918	1918-1990	1918-1990_углеводород_5355-14		Терпены -- углеводороды с общей формулой (C10H16)n.	11:23	0:51
углеводород	NOUN	1918	1918-1990	1918-1990_углеводород_5403-14		В томе рассказывается о достижениях советских ученых в химии углеводородов, элементоорганической химии, химии природных и биологически активных веществ.	61:74	0:152
углеводород	NOUN	1918	1918-1990	1918-1990_углеводород_5367-14		Расчеты позволили оценить канцерогенную активность почти всех ароматических углеводородов.	76:89	0:90
