lemma	pos	date	grouping	identifier	description	context	indexes_target_token	indexes_target_sentence	identifier_system	project	lang
сверстник	NOUN	1918	1918-1990	1918-1990_сверстник_4561		Для советской молодежи, как и для многих ее сверстников на нашей планете, антивоенное, антимилитаристское содержание фестиваля и его подготовка органически связаны с его антиимпериалистической направленностью, отвечающей всему духу фестивальных традиций.	44:55	0:254	4561	rushifteval	ru
сверстник	NOUN	1700	1700-1916	1700-1916_сверстник_4562		"Яков Львович, не будучи большим политиком, взирал на своих сверстников, которые его выдавали ""крапивному семени"", как на людей растленных в египетском рабстве мысли, и ничего не ожидал от их детей, как от детей рабов, которые если и почувствуют вкус к свободе, то не сумеют отличить ее от своеволия."	60:71	0:299	4562	rushifteval	ru
сверстник	NOUN	1918	1918-1990	1918-1990_сверстник_4563		Все они испытывали те же чувства, какие овладевают людьми, когда умирает сверстник: каждый боязливо и с тревогой думает, нет ли у него самого симптомов болезни, от которой скончался покойный.	73:82	0:191	4563	rushifteval	ru
сверстник	NOUN	1700	1700-1916	1700-1916_сверстник_4564		Характер у него был веселый, немножко заносчивый и дерзкий со старшими, но беспечный и общительный в сношениях с сверстниками, между которыми молодой человек имел друзей.	113:125	0:170	4564	rushifteval	ru
сверстник	NOUN	1918	1918-1990	1918-1990_сверстник_4565		Я сидлъ съ ногами на низкомъ подоконник и смотрлъ сверху, какъ на газон сада мои сверстники, въ такихъ же долгихъ розовыхъ рубашкахъ, въ какой былъ я, взявшись за руки, кружатся около столба съ лентами.	81:91	0:202	4565	rushifteval	ru
