lemma	pos	date	grouping	identifier	description	context	indexes_target_token	indexes_target_sentence	identifier_system	project	lang
стипендия	NOUN	1992	1992-2016	1992-2016_стипендия_5105		Либо лишать их пятерок, либо стипендий.	29:38	0:39	5105	rushifteval	ru
стипендия	NOUN	1700	1700-1916	1700-1916_стипендия_5106		Толковали между студентами и в обществе, что все офицеры артиллерийской академии подали по начальству рапорт, в котором просят удерживать пять процентов из их жалованья на уплату за бедных студентов; с негодованием передавали также, что стипендии бедным студентам будут отныне выдаваться не в университете, а чрез полицию, в полицейских камерах; толковали, что профессора просили о смягчении новых правил, потом просили еще, чтобы им было поручено исследовать все дело, и получили отказ и в том, и в другом, просили о смягчении участи арестованных студентов -- и новый отказ.	237:246	0:575	5106	rushifteval	ru
стипендия	NOUN	1992	1992-2016	1992-2016_стипендия_5107		Их поддержка помогла мне начать эту работу в Дибнеровском институте истории науки и техники благодаря стипендии фонда Берна Дибнера в 1993 году.	102:111	0:144	5107	rushifteval	ru
стипендия	NOUN	1700	1700-1916	1700-1916_стипендия_5108		Желающие воспользоваться этой стипендией приглашаются подавать прошения не позже 10 января 1914 г. (Наш. корр.) У рампы Владелец цирка Никитин показал красивый жест.	30:40	0:165	5108	rushifteval	ru
стипендия	NOUN	1992	1992-2016	1992-2016_стипендия_5109		"Кроме того, фонд ""Инзель Хомбройх"" выдает стипендии литераторам (на это средств почему-то хватает)."	42:51	0:99	5109	rushifteval	ru
стипендия	NOUN	1700	1700-1916	1700-1916_стипендия_5110		"Это стоило ему очень дорого, но он пробился все пять лет на своем ""коште"", а стипендии так и не взял."	77:86	0:101	5110	rushifteval	ru
стипендия	NOUN	1992	1992-2016	1992-2016_стипендия_5111		"Средства, заработанные вузом от образовательной и научной деятельности, должны оставаться у него в ""кармане"" , идти на повышение зарплат педагогам и стипендий студентам, закупку книг и оборудования, ремонт общежитий."	149:158	0:216	5111	rushifteval	ru
стипендия	NOUN	1700	1700-1916	1700-1916_стипендия_5112		Назначив и выдавши пособия и стипендии, надо иметь особо в виду то обстоятельство, что надлежащий результат может получиться от высшего образования лишь тогда, когда время студента будет отдано действительно образованию, т. е. надо соразмерить величину стипендии не только с предстоящими расходами, но и с действительным прилежанием и успехами стипендиатов, без чего стипендии и пособия студентам хотя будут оставаться делом благотворительным, но совершенно не отвечающим целям высших учебных заведений, так как их назначение исключительно состоит в подготовке для жизни деятельных и знающих людей, что и должно прежде всего блюсти распорядительному совету высшего учебного заведения.	29:38	0:684	5112	rushifteval	ru
стипендия	NOUN	1992	1992-2016	1992-2016_стипендия_5113		Например, что мы можем сделать для безработного Найти для него работу -- один вид помощи, другие -- платить пособие по безработице, переобучить и при этом платить стипендию, четвертое -- найти для него социальную работу (организовать полезные общественные работы -- подметать улицы и т. д.), пятое -- дать кредит на создание собственного дела, что, правда, бывает редко.	163:172	0:370	5113	rushifteval	ru
стипендия	NOUN	1700	1700-1916	1700-1916_стипендия_5114		Город собрал большую сумму (не помню цифры), из которой сделали похороны, поставили памятник, а из остатков соорудили памятник нетленный: две стипендии в Московском университете, именуемые тучковскими стипендиями.	142:151	0:213	5114	rushifteval	ru
стипендия	NOUN	1992	1992-2016	1992-2016_стипендия_5115		К четвертому курсу стипендия превратилась в пыль.	19:28	0:49	5115	rushifteval	ru
