lemma	pos	date	grouping	identifier	description	context	indexes_target_token	indexes_target_sentence	identifier_system	project	lang
стипендия	NOUN	1700	1700-1916	1700-1916_стипендия_5056		Рождение стипендии Биржевой комитет сообщает директору технического училища, что в ознаменование столетия Отечественной войны 1812 года мариупольское биржевое о-во постановило вносить ежегодно плату за 5 учеников технического училища из детей бедных рабочих, по выбору биржевого комитета.	9:18	0:288	5056	rushifteval	ru
стипендия	NOUN	1992	1992-2016	1992-2016_стипендия_5057		Продолжаю рассылать письма по различным канадским учреждениям, которые теоретически могли бы мною заинтересоваться и дать какую-нибудь стипендию или грант.	135:144	0:155	5057	rushifteval	ru
стипендия	NOUN	1700	1700-1916	1700-1916_стипендия_5058		"Та бросается в институт, там опять то же: ""Примем, если представите удостоверение областного правления о том, что вам дана стипендия""."	123:132	0:134	5058	rushifteval	ru
стипендия	NOUN	1992	1992-2016	1992-2016_стипендия_5059		Когда Офили исполнилось 24 года, он получил стипендию от Академии, но поехал не в Италию, а в Зимбабве.	44:53	0:103	5059	rushifteval	ru
стипендия	NOUN	1700	1700-1916	1700-1916_стипендия_5060		Зато, бывало, как только придет из Петербурга циркуляр о принятии пожертвований на памятник Феофану Прокоповичу или на стипендию имени генерал-майора Мардария Отчаянного, так тотчас же первая мысль: поскорее дать знать любезновцам!	119:128	0:231	5060	rushifteval	ru
стипендия	NOUN	1992	1992-2016	1992-2016_стипендия_5061		Московские коммунисты поддерживают требования пикетчиков национализировать природные ресурсы России и на этой основе покончить с обнищанием народа, подняв минимальные пенсии, заработок, стипендии до разумного уровня.	186:195	0:216	5061	rushifteval	ru
стипендия	NOUN	1700	1700-1916	1700-1916_стипендия_5062		Та обратилась в донское областное правление с просьбой назначить ей имевшуюся в данный момент свободную стипендию.	104:113	0:114	5062	rushifteval	ru
стипендия	NOUN	1992	1992-2016	1992-2016_стипендия_5063		Из его же бюджета оплачивалось общежитие и выдавалась стипендия, когда наш курс -- первый набор новорожденного филиала -- отправили на год в Москву.	54:63	0:148	5063	rushifteval	ru
стипендия	NOUN	1700	1700-1916	1700-1916_стипендия_5064		Он пожертвует литературному фонду двадцать пять, столько же в пользу высших женских курсов и ежегодно будет давать несколько стипендий студентам и курсисткам.	125:134	0:158	5064	rushifteval	ru
стипендия	NOUN	1992	1992-2016	1992-2016_стипендия_5065		Андрей Каплиев проиграл в Верховном суде дело о размере стипендии.	56:65	0:66	5065	rushifteval	ru
стипендия	NOUN	1700	1700-1916	1700-1916_стипендия_5066		Третьи заявляли, что хорошо бы было адрес благодарственный или хоть признательный представить барону и основать в честь его какую-нибудь стипендию.	137:146	0:147	5066	rushifteval	ru
стипендия	NOUN	1992	1992-2016	1992-2016_стипендия_5067		"В 1947 году мы были на практике на ""Ленфильме"" и, получив свою грошовую стипендию, тут же, голодные, все устремлялись в ""Норд"" за пирожными -- но не Рязанов."	72:81	0:157	5067	rushifteval	ru
стипендия	NOUN	1700	1700-1916	1700-1916_стипендия_5068		Лева продолжал бы университет на стипендию, Сережа продолжал бы служить, Илья пошел бы в управляющие, Маша вышла бы замуж за Пошу, детей бы распихали по заведениям, я ушла бы в гувернантки, мама завела бы какой-нибудь пансион, папа бы, верно, жил с Машей и Пошей.	33:42	0:263	5068	rushifteval	ru
стипендия	NOUN	1992	1992-2016	1992-2016_стипендия_5069		На основании п.1 данного приказа назначить студента очной бюджетной формы обучения факультета Иностранных Языков на стипендию с . Основание: заявление , согласие декана факультета.	116:125	0:180	5069	rushifteval	ru
стипендия	NOUN	1700	1700-1916	1700-1916_стипендия_5070		События дня Бобровское земское собрание учредило в будущем воронежском институте стипендию имени А. С. Суворина для крестьянских детей, а также по одной стипендии в бобровских гимназиях, фельдшерской, ветеринарной школах и учительской семинарии.	81:90	0:245	5070	rushifteval	ru
стипендия	NOUN	1992	1992-2016	1992-2016_стипендия_5071		Их интересовало, чем занимается Лаборатория, какая у меня стипендия, когда за нами приедут, сколько мне еще оставалось учиться, кем работают мои родители и сколько они получают.	58:67	0:177	5071	rushifteval	ru
стипендия	NOUN	1700	1700-1916	1700-1916_стипендия_5072		Вон один давеча стипендию какую-то хотел учредить.	16:25	0:50	5072	rushifteval	ru
стипендия	NOUN	1992	1992-2016	1992-2016_стипендия_5073		Кроме того, предприятие направляет на учебу в институты отличившихся рабочих с выплатой стипендии.	88:97	0:98	5073	rushifteval	ru
стипендия	NOUN	1700	1700-1916	1700-1916_стипендия_5074		Она решилась завещать его на учреждение одной или двух стипендий в том институте, который дал ей приют.	55:64	0:103	5074	rushifteval	ru
стипендия	NOUN	1992	1992-2016	1992-2016_стипендия_5075		Позже, когда после смерти отца мама сумела устроить Барбару на благотворительную стипендию в университет, ответ нашелся.	81:90	0:120	5075	rushifteval	ru
стипендия	NOUN	1700	1700-1916	1700-1916_стипендия_5076		Совет Саратовскаго университета в ознаменование 300-летия Дома Романовых постановил учредить стипендию имени царя Михаила.	93:102	0:122	5076	rushifteval	ru
стипендия	NOUN	1992	1992-2016	1992-2016_стипендия_5077		В восемнадцатилетнем возрасте Шеххи, получив военную стипендию, приехал в Германию на учебу.	53:62	0:92	5077	rushifteval	ru
стипендия	NOUN	1700	1700-1916	1700-1916_стипендия_5078		Я знал, что если скажу, то Классовский предложит поделиться своими крохами или выхлопочет мне стипендию.	94:103	0:104	5078	rushifteval	ru
стипендия	NOUN	1992	1992-2016	1992-2016_стипендия_5079		Отвечая на мои вопросы, он объяснил, что это такое: даются стипендии ученым, и не только ученым, из разных стран для исследований на предложенную ими же тему.	59:68	0:158	5079	rushifteval	ru
стипендия	NOUN	1700	1700-1916	1700-1916_стипендия_5080		Когда государство дает свои средства отдельному лицу на его образование, оно, по моему крайнему разумению, должно всегда требовать или возврата выданной ему стипендии, или обязательной за нее службы в тех местах, куда будет назначен окончивший курс.	157:166	0:249	5080	rushifteval	ru
стипендия	NOUN	1992	1992-2016	1992-2016_стипендия_5081		Стипендии нас давно лишили.	0:9	0:27	5081	rushifteval	ru
стипендия	NOUN	1700	1700-1916	1700-1916_стипендия_5082		Казенные стипендии выдаются только христианам (а теперь, по сообщениям газет, и все вообще стипендии).	9:18	0:102	5082	rushifteval	ru
стипендия	NOUN	1992	1992-2016	1992-2016_стипендия_5083		Значит, и суммы, необходимые на учебники и стипендии, далеки от реальности.	43:52	0:75	5083	rushifteval	ru
стипендия	NOUN	1700	1700-1916	1700-1916_стипендия_5084		Да и не слишком ли скромен защитник, требуя лишь оправдания подсудимого Отчего бы не потребовать учреждения стипендии имени отцеубийцы, для увековечения его подвига в потомстве и в молодом поколении Исправляются Евангелие и религия: это, дескать, все мистика, а вот у нас лишь настоящее христианство, уже проверенное анализом рассудка и здравых понятий.	108:117	0:353	5084	rushifteval	ru
стипендия	NOUN	1992	1992-2016	1992-2016_стипендия_5085		На встрече им вручались именные дипломы, стипендии за четыре месяца и памятные подарки.	41:50	0:87	5085	rushifteval	ru
стипендия	NOUN	1700	1700-1916	1700-1916_стипендия_5086		Будут учреждены стипендии безвременно погибших писателей Успенского, Гаршина и Надсона, которые по свойству своей болезни нуждались в лечении при условии полного покоя. неизвестный.	16:25	0:181	5086	rushifteval	ru
стипендия	NOUN	1992	1992-2016	1992-2016_стипендия_5087		Разработана новая система выплаты стипендий по категориям -- экономическая, социальная, правительственная.	34:43	0:106	5087	rushifteval	ru
стипендия	NOUN	1700	1700-1916	1700-1916_стипендия_5088		"В первое время среди ее учеников являются князь Барятинский, Бутурлин и других знатных людей дети на своем содержании; но потом в школу вступают все люди с темными именами и большею частью в ""кормовые ученики"", на казенные стипендии в 90 -- 300 рублей на наши деньги."	223:232	0:267	5088	rushifteval	ru
стипендия	NOUN	1992	1992-2016	1992-2016_стипендия_5089		"Да и с теперешней жизнью ""на виду"" не больно разгуляешься на студенческую стипендию."	74:83	0:84	5089	rushifteval	ru
стипендия	NOUN	1700	1700-1916	1700-1916_стипендия_5090		§ 2), с предоставлением вам права увольнять и удалять от должности и определять вместо уволенных или удаленных лиц -- других по собственному вашему избранию (§ 3 и 4) и усиливать, с разрешения министерства, личный состав инспекции, употребляя на покрытие необходимых для сего расходов специальные средства университета, которые прежде всего должны служить удовлетворению важнейшей при настоящих обстоятельствах потребности университета -- сохранению внутреннего в нем порядка и спокойствия и восстановлению духа порядка и дисциплины между учащимися; и наконец, с предоставлением вам же и вашему руководству главнейшего влияния на наложение более строгих взысканий с учащихся (§ 21 и 22) и на предоставление достойным из них стипендий, пособий и льгот относительно платы за слушание лекций, на вас, как на попечителя учебного округа, возлагается и весьма значительная ответственность за успешное достижение тех целей, коим должна служить университетская инспекция.	724:733	0:963	5090	rushifteval	ru
стипендия	NOUN	1992	1992-2016	1992-2016_стипендия_5091		Расходы бюджета (Р) группируются: к первой группе относятся защищенные статьи (заработная плата работникам бюджетной сферы, начисления на заработную плату, стипендии, пособия и пр.) (Р1); вторая группа охватывает текущие расходы бюджета, за исключением защищенных статей (Р2); к третьей группе относятся капитальные расходы (Р3).	156:165	0:329	5091	rushifteval	ru
стипендия	NOUN	1700	1700-1916	1700-1916_стипендия_5092		В омском сельскохозяйственном училище воспитанники сделали подписку в пользу недостаточного товарища и на собранные деньги учредили для него временную стипендию. неизвестный.	151:160	0:174	5092	rushifteval	ru
стипендия	NOUN	1992	1992-2016	1992-2016_стипендия_5093		"Москвы на 1996 год"" ""Законодательные акты Федерального собрания"" Лесной кодекс Российской Федерации (отклонен президентом) Проект закона ""О порядке возмещения материального ущерба в связи с нарушением сроков выплаты заработной платы, пенсий, стипендий, пособий и других социальных выплат"" (отклонен президентом) Проект закона ""О внесении изменений и дополнений в Закон Российской Федерации ""О банках и банковской деятельности в РСФСР"""" (отклонен президентом) Проект закона ""О международных договорах Российской Федерации о правопреемстве в отношении внешнего государственного долга и активов Союза ССР и реструктуризации внешнего государственного долга Союза ССР"" (отклонен президентом) Проект закона ""О стабилизации энергоснабжения населения, организаций и предприятий народного хозяйства"" (отклонен президентом) Проект закона ""Об энергосбережении"" (отклонен президентом) Закон ""О внесении дополнений в статью 12 закона РСФСР ""О государственных пенсиях в РСФСР"""" (отклонен президентом) Проект закона ""О товариществах собственников жилья"" (отклонен президентом) Проект закона ""Об участии в международном информационном обмене"" (отклонен президентом) Проект закона ""О государственной регистрации юридических лиц"" (отклонен президентом) Проект закона ""Об индивидуальном (персонифицированном) учете в системе государственного пенсионного страхования"" (отклонен президентом) Проект закона ""О нефти и газе"" (Дума не преодолела вето президента) Проект закона ""О бухгалтерском учете"" (Дума не преодолела вето президента) ""Постановления правительства и ведомств"" Проект положения о порядке допуска отечественных и зарубежных организаций к экспертной оценке количества, качества и соответствия цены конкретных видов экспортируемых товаров Проект постановления о приватизации компании ""Росгосстрах"" Проект постановления о проведении конкурсов и аукционов по продаже земельных участков и других операций с землей Проект постановления о порядке формирования и расходования средств отраслевых целевых фондов Проект постановления ""О создании государственного реестра участников внешнеэкономической деятельности РФ"" Проект положения ""О процентной политике ЦБ"" Проект положения ""Об операциях ЦБ на открытом рынке"" Проект положения ""О рефинансировании"" (ЦБ) Проект положения ""О национальном банковском совете"" ""Указы и распоряжения президента"" Проект указа о создании свободной экономической зоны ""Дагестан"" Публикуемый в выходящих по вторникам номерах Ъ мониторинг экономического законодательства представлен в следующем виде."	242:251	0:2510	5093	rushifteval	ru
стипендия	NOUN	1700	1700-1916	1700-1916_стипендия_5094		"Смета здания исчислена в 70 000 р. и оборудования -- в 30 000 р. -- Товарищество ""Наследники Н. М. Полушина"" препроводили в университет 6 000 р. для образования стипендии имени умершего директора фирмы П. П. Хабарина."	161:170	0:217	5094	rushifteval	ru
стипендия	NOUN	1992	1992-2016	1992-2016_стипендия_5095		Правда, ему стипендию положили -- 35 рублей.	12:21	0:44	5095	rushifteval	ru
стипендия	NOUN	1700	1700-1916	1700-1916_стипендия_5096		Ко дню рождения королевы Ортруды набралось, как всегда, очень много писем и прошений о пособиях, стипендиях, зависящих лично от неё, и о разных других милостях.	97:107	0:160	5096	rushifteval	ru
стипендия	NOUN	1992	1992-2016	1992-2016_стипендия_5097		"Поэтому и учеба сразу пошла хорошо, даже отлично, что и позволило Папикову немедленно выхлопотать ""для лучшей медицинской сестры Советского Союза"" именную стипендию."	155:164	0:165	5097	rushifteval	ru
стипендия	NOUN	1700	1700-1916	1700-1916_стипендия_5098		Но, говоря вообще, дело стипендий должно быть ведено, по моему мнению, с наименьшим участием профессоров и в размеры стипендий должны входить, если не всегда, то в огромном большинстве случаев, все расходы или взносы, требуемые уставом с университетских слушателей.	24:33	0:265	5098	rushifteval	ru
стипендия	NOUN	1992	1992-2016	1992-2016_стипендия_5099		Материалы и заявку можно прислать/принести по адресу: 125993 Москва, Газетный пер., д. 5, 6-й эт., IREX ... и исследователей Институт изучения передовых технологий, науки, и общества IAS-STS (Австрия, г. Грац) учреждает 5 грантов (EUR 1000 в месяц) на стипендии на период с 1.10.04 по 30.07.05 гг по направлениям: гендерные исследования -- исследования технологий -- исследования окружающей среды; этические, правовые, социальные аспекты исследований генома; биотехнологии; исследования технологий в связи с проблемой устойчивости развития общества.	252:261	0:549	5099	rushifteval	ru
стипендия	NOUN	1700	1700-1916	1700-1916_стипендия_5100		Исеева, имея уже несколько серебряных медалей, я обращался с прошениями в Академию художеств на имя князя Гагарина (вице-президента Академии художеств) и о пособии и о стипендии, но без успеха.	168:177	0:193	5100	rushifteval	ru
стипендия	NOUN	1992	1992-2016	1992-2016_стипендия_5101		Трехразовое питание, балахон за счет казны и стипендия пять монет!	45:54	0:66	5101	rushifteval	ru
стипендия	NOUN	1700	1700-1916	1700-1916_стипендия_5102		"Студенческая жизнь Напоминаем недостаточным студентам, что 15 октября истекает срок подачи прошений в комитет общества для пособия нуждающимся студентам"" о назначении нескольких остающихся незамещенными стипендий."	203:212	0:213	5102	rushifteval	ru
стипендия	NOUN	1992	1992-2016	1992-2016_стипендия_5103		А если хоть одна четверка, то или пенсию, или стипендию.	46:55	0:56	5103	rushifteval	ru
стипендия	NOUN	1700	1700-1916	1700-1916_стипендия_5104		Сознаюсь вам, меня, как и вас когда-то, обуревают теперь мечты об уроках, стипендиях, переписке бумаг в крайнем случае и тому подобном.	74:84	0:135	5104	rushifteval	ru
