lemma	pos	date	grouping	identifier	description	context	indexes_target_token	indexes_target_sentence
маньяк	NOUN	1700	1700-1916	1700-1916_маньяк_2690-16		Я заранее был уверен, что Вы во всяком случае не посоветуете мне насиловать свою природу, жить в среде, сделавшейся мне антипатичной, оставаться в таком положении, которое поневоле делает меня праздным, бессмысленно проводящим жизнь маньяком.	233:241	0:242
маньяк	NOUN	1700	1700-1916	1700-1916_маньяк_2692-16		Он сделался впоследствии положительно маньяком.	38:46	0:47
маньяк	NOUN	1700	1700-1916	1700-1916_маньяк_2658-16		А кто опять виноват в Кармазинове Навязывал я вам его или нет Участвовал в его обожании или нет Ну, да черт с ним, а вот третий маньяк, политический, ну это другая статья.	128:134	0:171
маньяк	NOUN	1700	1700-1916	1700-1916_маньяк_2714-16		Ну, словом, посторонний человек, попавший бы в эту комнату, мог подумать, что я -- маньяк, бездарный и ничего не смыслящий писака, пришедший к знаменитому музыканту приставать с своей дребеденью.	83:89	0:195
маньяк	NOUN	1700	1700-1916	1700-1916_маньяк_2694-16		Наумов смотрел вокруг дикими глазами, напряженными, как у маньяка, и пил только крепкий чай.	58:65	0:92
маньяк	NOUN	1700	1700-1916	1700-1916_маньяк_2680-16		Многое, по его мнению важное, на самом деле мне казалось неважным и опущено, как совершенно не идущее к делу, или же изложено кратче моими словами, причем вся суть событий сохранена, а откинуты повторения и другие приемы многословия мечтательного маньяка, через которые рассказ его был бы не свободен от длиннот и через то непременно утрачивал бы интерес.	247:254	0:355
маньяк	NOUN	1700	1700-1916	1700-1916_маньяк_2712-16		-- Ни о чем, -- чистый маньяк.	23:29	0:30
маньяк	NOUN	1700	1700-1916	1700-1916_маньяк_2700-16		Напротив, если духовное равновесие разрушено совершенно, если человек, как бесноватый, одержим одною дикою страстью и ко всему другому восприимчивость в нем потухла, -- он или маньяк, которого надо лечить, или воплощенный дьявол, для которого все человеческое кончено.	176:182	0:268
маньяк	NOUN	1700	1700-1916	1700-1916_маньяк_2682-16		Но "маньяк" наконец опустил руку, задыхаясь и дрожа и не в силах будучи говорить.	4:10	0:81
маньяк	NOUN	1700	1700-1916	1700-1916_маньяк_2710-16		И точно, Юлиан, задумавший повернуть колесо истории, не безумец ли, не маньяк Он осужден на гибель, а осужденный на гибель разве может оказаться правым Нет, нет и нет -- прав победитель, прав торжествующий.	71:77	0:206
маньяк	NOUN	1700	1700-1916	1700-1916_маньяк_2698-16		Какой странный маньяк!	15:21	0:22
маньяк	NOUN	1700	1700-1916	1700-1916_маньяк_2708-16		Он производит впечатление маньяка.	26:33	0:34
маньяк	NOUN	1700	1700-1916	1700-1916_маньяк_2656-16		Его блестящие, как у маньяка, глаза пристально смотрели на огонь свечи, но как будто ничего не видели.	21:28	0:102
маньяк	NOUN	1700	1700-1916	1700-1916_маньяк_2706-16		Вся Флоренция знала этого старика, которого страсть к древности сделала маньяком.	72:80	0:81
маньяк	NOUN	1700	1700-1916	1700-1916_маньяк_2704-16		Туганов посмотрел ему вслед и тихо сказал Дарьянову: -- Он у вас совсем маньяк сделался.	72:78	0:88
маньяк	NOUN	1700	1700-1916	1700-1916_маньяк_2696-16		Передо мной был какой-то маньяк, на которого всякая моя попытка успокоения производила совершенно обратное действие.	25:31	0:116
маньяк	NOUN	1700	1700-1916	1700-1916_маньяк_2662-16		"Автономная группа" подпольных убийц, политических маньяков открыла свою работу этим первым, ужасающим злодеянием и отняла сразу самое дорогое, что было у правительства, страны и у законопослушной части общества.	51:59	0:212
маньяк	NOUN	1700	1700-1916	1700-1916_маньяк_2660-16		Фишла, как и следовало ожидать, приняли за сумасшедшего, и даже не особенно удивлялись этому, так как и раньше некоторые близкие ему люди считали его маньяком, судя по его рассеянности и странностям.	150:158	0:199
маньяк	NOUN	1700	1700-1916	1700-1916_маньяк_2686-16		Унять было невозможно, по крайней мере в ту минуту, и -- вдруг окончательная катастрофа как бомба разразилась над собранием и треснула среди его: третий чтец, тот маньяк, который все махал кулаком за кулисами, вдруг выбежал на сцену.	163:169	0:233
маньяк	NOUN	1700	1700-1916	1700-1916_маньяк_2670-16		-- Да, конечно, маньяк.	16:22	0:23
маньяк	NOUN	1700	1700-1916	1700-1916_маньяк_2684-16		.. разговором, который хотя прямо не оскорблял Савелия, но из которого все-таки выходило, что заботы его и беспокойства не что иное, как нетерпеливая суета и сам он маньяк.	165:171	0:172
маньяк	NOUN	1700	1700-1916	1700-1916_маньяк_2674-16		Обзор исторический "Экспертиза медиков стремясь доказать нам, что подсудимый не в своем уме и маньяк.	94:100	0:101
маньяк	NOUN	1700	1700-1916	1700-1916_маньяк_2676-16		"Если гомеопаты не обходятся без прививок, то чего же нам стесняться!" -- так утешают себя маньяки прививок, упуская из виду, что и в лагере аллопатов с каждым днем люди науки, а не диплома, все сильней и сильней возмущаются безумием, охватившим прививочников, кстати сказать, совсем не обращающих внимания на побочные действия, выражаясь языком д-ра Оппенгейма, "небезразличные для организма" и в психическом отношении.	91:98	0:420
маньяк	NOUN	1700	1700-1916	1700-1916_маньяк_2678-16		За границей они разыгрывают каких-то чудаков, маньяков, делают на каждом шагу эксцентричности, одеваются по-шутовски, не соблюдая приличия.	46:54	0:139
маньяк	NOUN	1700	1700-1916	1700-1916_маньяк_2672-16		Случалось этой зимой, беглец жестоко отмораживал себе ноги и чуть не ползком добирался до желанной цели, но все-таки добирался, упорный, как маньяк.	141:147	0:148
маньяк	NOUN	1700	1700-1916	1700-1916_маньяк_2702-16		Плюшкин, грязный и грубый маньяк, нам противен, но, кто знает, может быть, он делает свое, возложенное на него природой серьезное и важное дело.	26:32	0:144
маньяк	NOUN	1700	1700-1916	1700-1916_маньяк_2668-16		Маньякам так называемого прогресса кажется, что они охвачены творчеством, -- на самом деле они охвачены разрушением.	0:8	0:116
маньяк	NOUN	1700	1700-1916	1700-1916_маньяк_2666-16		-- Довольно! -- вскричал он яростно, -- вы не только исключены из круга порядочных людей, но вы -- маньяк, настоящий помешанный маньяк, и так вас аттестовали!	99:105	0:158
маньяк	NOUN	1700	1700-1916	1700-1916_маньяк_2688-16		Что же до того, что он маньяк, то с этим я бы согласился, но именно в одном только пункте -- в том самом, на который экспертиза указывала, именно во взгляде подсудимого на эти три тысячи, будто бы недоплаченные ему отцом.	23:29	0:221
маньяк	NOUN	1700	1700-1916	1700-1916_маньяк_2664-16		Дошел до того, что кажется маньяком: подбирает рифмы к каждому услышанному слову.	27:35	0:81
маньяк	NOUN	1992	1992-2016	1992-2016_маньяк_2689-16		Так вот господин маньяк пожаловался на бесчеловечные условия, в которых оказался в тюрьме.	17:23	0:90
маньяк	NOUN	1992	1992-2016	1992-2016_маньяк_2693-16		-- Урк! -- ближайший маньяк, не в силах совладать с буйством желания, страстно обнял мои бедра.	21:27	0:95
маньяк	NOUN	1992	1992-2016	1992-2016_маньяк_2685-16		Мы же были твердо уверены, что действует маньяк, а маньяки всегда одиночки.	41:47	0:75
маньяк	NOUN	1992	1992-2016	1992-2016_маньяк_2687-16		И расчлененные трупы, и выброшенные в мусор посиневшие младенцы, и сожженные заживо семьи, и ухмылочки маньяков, собирающихся закосить под душевнобольных, -- все это поначалу шокировало Сергея.	103:111	0:193
маньяк	NOUN	1992	1992-2016	1992-2016_маньяк_2683-16		А как он взбеленился, когда Настя только заикнулась о том, что Лазарева не убийца и вообще тут действовал не маньяк.	109:115	0:116
маньяк	NOUN	1992	1992-2016	1992-2016_маньяк_2699-16		Фома без слов ползал по полу, лез под стол и с упорством маньяка складывал новую башню.	57:64	0:87
маньяк	NOUN	1992	1992-2016	1992-2016_маньяк_2697-16		С этих площадок ребенок радостно уйдет с любым маньяком в даль светлую.	47:55	0:71
маньяк	NOUN	1992	1992-2016	1992-2016_маньяк_2695-16		Специально для таких маньяков как я на рынке появилось новое устройство PlusDeck 2.	21:29	0:83
маньяк	NOUN	1992	1992-2016	1992-2016_маньяк_2691-16		Бдительность усилили, но и маньяков, увы, все больше.	27:35	0:53
маньяк	NOUN	1992	1992-2016	1992-2016_маньяк_2715-16		А под маньяка дадут.	6:13	0:20
маньяк	NOUN	1992	1992-2016	1992-2016_маньяк_2703-16		Глаза в темных глубоких ямах, в них топь, это не остекленевшие глаза Соколова, это не втягивающие какой-то страстью глаза Абакумова, это глаза маньяка... его не за зверства списали с Лубянки, там за зверства получают ордена и генеральские звезды, за распутство, глаза полового маньяка.	143:150	0:285
маньяк	NOUN	1992	1992-2016	1992-2016_маньяк_2669-16		-- Подделка под стиль маньяка.	22:29	0:30
маньяк	NOUN	1992	1992-2016	1992-2016_маньяк_2671-16		Гендиректор Золкин вспомнил и маньяка, который не так давно всего за три часа поджег 14 лифтов на улице в Люблине, на улице Белореченской.	30:37	0:138
маньяк	NOUN	1992	1992-2016	1992-2016_маньяк_2673-16		Две недели подряд я шел и неотвязно, словно маньяк, думал, что все, больше не могу, грязь такая, что в ней буквально тонешь, делаю шаг, хочу сделать второй и вижу, сапог остался в глине, а я собираюсь идти дальше в одних портянках.	44:50	0:231
маньяк	NOUN	1992	1992-2016	1992-2016_маньяк_2675-16		-- Погодите, Олег Григорьевич, но ведь в ваших статьях написано, что, когда программа заканчивается, маньяк больше не убивает и опасности не представляет.	101:107	0:154
маньяк	NOUN	1992	1992-2016	1992-2016_маньяк_2677-16		Только преследований маньяка мне в таком состоянии не хватало.	21:28	0:62
маньяк	NOUN	1992	1992-2016	1992-2016_маньяк_2679-16		У Дюрренматта герой -- блестящий молодой криминалист, который придумывает план поимки маньяка и сходит с ума, когда план не срабатывает.	86:93	0:136
маньяк	NOUN	1992	1992-2016	1992-2016_маньяк_2665-16		Погони слышно не было -- видимо, все-таки сумасшедшего маньяка кто-то утихомирил.	55:62	0:81
маньяк	NOUN	1992	1992-2016	1992-2016_маньяк_2663-16		Она была тощим двенадцатилетним подростком, и слова такого не знала -- маньяк, ей никто не сказал, что такое бывает.	71:77	0:116
маньяк	NOUN	1992	1992-2016	1992-2016_маньяк_2661-16		Однако по своему следственному опыту Глушенкова знала, что именно такой тип представительниц женского пола привлекает психически больных людей, пьяниц и маньяков.	153:161	0:162
маньяк	NOUN	1992	1992-2016	1992-2016_маньяк_2659-16		Хоть один реальный маньяк был киноманом Чикатило если и смотрел фильмы, то исключительно нравственные советские -- других при нем не было.	19:25	0:138
маньяк	NOUN	1992	1992-2016	1992-2016_маньяк_2657-16		Но чем неблагоприятнее социальная обстановка, тем больше вероятность появления новых маньяков.	85:93	0:94
маньяк	NOUN	1992	1992-2016	1992-2016_маньяк_2713-16		Преступная идея -- это вопль истинно несчастных: всех, кто лишен совести и сострадания, всех безвольных и слабохарактерных, всех психопатов, убийц, маньяков, насильников, душегубов, аферистов, бандитов, психически больных, неверящих, бесталанных и бездарных.	148:156	0:258
маньяк	NOUN	1992	1992-2016	1992-2016_маньяк_2667-16		Иное дело -- начало 90-х, когда он изображался исключительно как "садист и кровавый маньяк".	84:90	0:92
маньяк	NOUN	1992	1992-2016	1992-2016_маньяк_2681-16		Буквы были большие и кривые, словно писал ребенок -- или маньяк.	57:63	0:64
маньяк	NOUN	1992	1992-2016	1992-2016_маньяк_2709-16		Я же, лелея в памяти момент, когда моя одиннадцатимесячная дочка сделала первые шаги по свежескошенному идеальному ежику сентябрьской травы, с упорством маньяка жажду газона, потому что сыну не на чем, понимаете, совершенно не на чем делать первые шаги!	153:160	0:253
маньяк	NOUN	1992	1992-2016	1992-2016_маньяк_2707-16		И так уже прослыл каким-то маньяком.	27:35	0:36
маньяк	NOUN	1992	1992-2016	1992-2016_маньяк_2705-16		-- Вы что, хотите сказать, будто меня маньяк какой-то преследует -- Зойка, прежде чем воображать всякие ужасы, купи телефон с определителем номера!	38:44	0:147
маньяк	NOUN	1992	1992-2016	1992-2016_маньяк_2701-16		Кто же этот злобный маньяк!	20:26	0:27
маньяк	NOUN	1992	1992-2016	1992-2016_маньяк_2711-16		Нельзя лечить политических маньяков, оставаясь маньяками религиозными, не освободившись от идеи своей безусловной правоты в вере.	27:35	0:129
