lemma	pos	date	grouping	identifier	description	context	indexes_target_token	indexes_target_sentence
верховье	NOUN	1992	1992-2016	1992-2016_верховье_41-16		Переселенцы освоили новые земли довольно быстро, вывели новую породу коров (немецкая красно-степная), в верховья Волги пошли баржи с немецким зерном.	104:112	0:149
верховье	NOUN	1992	1992-2016	1992-2016_верховье_29-16		Мы воспользовались случаем забросить наши резиновые лодки в верховья Аламджаха, где нам предстояло отобрать образцы.	60:68	0:116
верховье	NOUN	1992	1992-2016	1992-2016_верховье_57-16		На южном склоне перевала Тюзашу (бассейн р. Сусамыр) этот же вид собран из ручья на высоте 3200-3300 м. В Аксу-Джабаглинском заповеднике встречался в довольно большом числе на высотах 1500-2300 м во второй половине апреля в верховьях рек Джабаглы, Малый и Большой Балдабрек.	224:233	0:274
верховье	NOUN	1992	1992-2016	1992-2016_верховье_55-16		После выхода из балки (в верховьях, после источника Ахлаплых, она уже называется Кичик-Ахлаплых) на водораздельный гребень идёт на ЮВ в сторону обрывов Байдаро-Кастропольской стены, по выходу из леса поворачивает на В и затем идёт вдоль обрывов до самой Чертовой лестницы.	25:34	0:272
верховье	NOUN	1992	1992-2016	1992-2016_верховье_7-16		Прилетели птицы, мужики вышли в поле, рыбачьи пыжи понеслись в верховья за нерестившейся рыбой.	63:71	0:95
верховье	NOUN	1992	1992-2016	1992-2016_верховье_37-16		Их вызывает переполнение и (или) прорыв озер в верховьях рек.	47:56	0:61
