lemma	pos	date	grouping	identifier	description	context	indexes_target_token	indexes_target_sentence
любовь	NOUN	1918	1918-1990	1918-1990_любовь_2636-15		У меня забилось сердце, выступил пот, и я повалился на землю, и в это время я не был Собою, а был только одною дивною, как огонь, любовью.	130:137	0:138
любовь	NOUN	1918	1918-1990	1918-1990_любовь_2626-15		Она тебе на все береговые, на пятнадцать там или семнадцать дней, лучшую жизнь обеспечит -- тепло и уют, и питье с наилучшей закусью, и телевизор, и верную любовь.	156:162	0:163
любовь	NOUN	1918	1918-1990	1918-1990_любовь_2652-15		Убивали нас царские палачи и жандармы, убивали юнкера в Октябре, убивали беляки, интервенты всех стран света, махновцы и антоновцы, кулаки по нас стреляли из обрезов, а мы все живы любовью народной.	181:188	0:198
любовь	NOUN	1918	1918-1990	1918-1990_любовь_2640-15		Храм не ограничен этими стенами, храм вмещает вечность, храм вмещает Бога, храм вмещает всю любовь Господню к этой многострадальной и грешной земле, на которой живут люди, по всему лицу мира.	92:98	0:191
любовь	NOUN	1918	1918-1990	1918-1990_любовь_2624-15		Любовь к людям -- это и есть любовь к жизни.	0:6	0:44
любовь	NOUN	1918	1918-1990	1918-1990_любовь_2596-15		Он проживал свою жизнь в каждом встреченном им человеке, а любви в его сердце не убывало.	59:64	0:89
любовь	NOUN	1918	1918-1990	1918-1990_любовь_2594-15		-- Голова об экспертизе думает, а уста признаются в любви.	52:57	0:58
любовь	NOUN	1918	1918-1990	1918-1990_любовь_2598-15		Ибо, конечно, случилось неизбежное: чистейший Чернышевский -- никогда таких мест не посещавший, -- в бесхитростном стремлении особенно красиво обставить общинную любовь, невольно и бессознательно, по простоте воображения, добрался как раз до ходячих идеалов, выработанных традицией развратных домов: его веселый вечерний бал, основанный на свободе и равенстве отношений (то одна, то другая чета исчезает и потом возвращается опять) очень напоминает, между прочим, заключительные танцы в "Доме Телье".	162:168	0:500
любовь	NOUN	1918	1918-1990	1918-1990_любовь_2600-15		В течение всего Великого Поста и недель, которые следуют за Пасхой и за Пятидесятницей, мы читаем евангельские отрывки о том, как Господь проявил Свою милость, и Свою любовь, и Свою спасающую силу в человеческом роде; читаем о древнем и читаем о евангельском.	167:173	0:259
любовь	NOUN	1918	1918-1990	1918-1990_любовь_2650-15		Первая любовь Пушкина, о которой знали только люди, знавшие все, о которой он вспомнил, умирая, -- вот характер отношений Пушкина и Карамзиной.	7:13	0:143
любовь	NOUN	1918	1918-1990	1918-1990_любовь_2602-15		Для прочтения подобного труда требовались не только специальные знания и терпеливая выдержка, но еще вдобавок энтузиазм любви или ненависти.	120:125	0:140
любовь	NOUN	1918	1918-1990	1918-1990_любовь_2606-15		Тем более непонятная, ибо в самом ответе лежало противоречие -- отказ и одновременно стремление, страх и любовь, бегство и защита.	105:111	0:130
любовь	NOUN	1918	1918-1990	1918-1990_любовь_2608-15		Так, наверное, боятся те, кто любил, рассказывать о любви.	52:57	0:58
любовь	NOUN	1918	1918-1990	1918-1990_любовь_2610-15		Я писал: Чехов более для меня символист, чем Морис Метерлинк; а тут -- нате: "неизреченность" вводилась в салон; а анархия становилась свержением штанов под девизами "нового" культа; этого Чулков не желал; но писал неумно; вот "плоды" -- лесбианская повесть Зиновьевой-Аннибал и педерастические стихи Кузмина; они вместе с программной лирикой Вячеслава Иванова о "333" объятиях брались слишком просто в эротическом, плясовом, огарочном* бреде; "оргиазм" В. Иванова на языке желтой прессы понимался упрощенно: "свальным грехом"; почтенный же оргиаст лишь хитренько помалкивал: "Понимайте как знаете!" * "Огарочной психологией" в то время называли проповедь "трын-травизма", подхватываемую послереволюционным надрывом; "огарочное" настроение захватывало и молодежь Я ставил точку над "и": -- "Отмежуйтесь: раскройте "объятия", чтобы стало ясно, во что жаждете преодолеть символизм: в народ или -- в хлыстовскую баню" Не раз я получал ответ, -- шепотком, на ушко: -- "Как можешь ты думать так" После чего писалось стихотворение, смысл которого вызывал во мне вскрик: изнасилование девушки называлось громко "причастием"; не нравились и филологические комментарии на смысл евангельской любви с неизменным припевом: любовь -- дерзновенна; хотелось воскликнуть: в каком же смысле Розанов хрюкал весьма недвусмысленно: эта любовь -- платоническая; а Платон любил юношей.;	1211:1217	0:1364
любовь	NOUN	1918	1918-1990	1918-1990_любовь_2614-15		Никакая любовь не брала его.	8:14	0:28
любовь	NOUN	1918	1918-1990	1918-1990_любовь_2616-15		Одновременно с этим школа ставит себе целью возбудить и усилить в.своих питомцах национальные чувства: радость к "немецкому творчеству", любовь к кайзеру и к родине.	137:143	0:165
любовь	NOUN	1918	1918-1990	1918-1990_любовь_2618-15		Добром, любовью хотела отогреть его душу.	8:15	0:41
любовь	NOUN	1918	1918-1990	1918-1990_любовь_2620-15		Если бы она была развитее, то назвала бы "дельцом любви" и этим бы подчеркнула некоторую второкачественность моей любви, т. е. примесь в ней эгоизма, ограничение любви.	50:55	0:168
любовь	NOUN	1918	1918-1990	1918-1990_любовь_2622-15		Музыка туркмен идет в два голоса -- арифметика любви двоих.	47:52	0:59
любовь	NOUN	1918	1918-1990	1918-1990_любовь_2604-15		Если бы наши сердца были открыты и если бы каменные сердца мы дали Богу претворить в сердца плотяные, если бы мы научились великодушию и взаимной ответственности друг за друга, если бы мы научились хоть немного -- о, хоть самую каплю! -- деятельной любви к ближнему, то не было бы голода в мире.	249:254	0:295
любовь	NOUN	1918	1918-1990	1918-1990_любовь_2648-15		Она завоевала любовь бакинских зрителей исполнением ролей леди Макбет, Дездемоны, Кручининой.	14:20	0:93
любовь	NOUN	1918	1918-1990	1918-1990_любовь_2612-15		Пройдет положенное время, наука и людская совесть по-настоящему расправят свои крылья, каракули выравнятся, встанут четкими рядами, вспыхнут огнем, и вместе с ними вспыхнет сердце человека в высокой любви, в порыве исканий недостижимого идеала во благо всех людей.	199:204	0:264
любовь	NOUN	1918	1918-1990	1918-1990_любовь_2634-15		Ваше имя, князь Петра Михайловича и дитяти, Богом данного князь Григория Петровича, в пирамидах при разных огнях зажжено было, -- далее за полночь, по здешнему обыкновению, угощаемые разъехались с полной любовью к вам, княгиня Софья Григорьевна".	204:211	0:246
любовь	NOUN	1918	1918-1990	1918-1990_любовь_2638-15		Маммея, как девочка, стала есть их, слушая стихи о любви и смерти.	51:56	0:66
любовь	NOUN	1918	1918-1990	1918-1990_любовь_2632-15		"Кто подымет покров с лица моего, -- умрет", мог бы сказать и он, как древне-вавилонская богиня любви, Иштарт.	96:101	0:110
любовь	NOUN	1918	1918-1990	1918-1990_любовь_2642-15		Конечно, такое захоронение любви напоминает убийство, но что же делать, если иногда у вас просто нет иного выхода.	27:32	0:114
любовь	NOUN	1918	1918-1990	1918-1990_любовь_2630-15		Окружите их любовью, будьте милостивы друг к другу, и идите в мире, творя дело Божие.	12:19	0:85
любовь	NOUN	1918	1918-1990	1918-1990_любовь_2644-15		Зло существует на кредит любви.	25:30	0:31
любовь	NOUN	1918	1918-1990	1918-1990_любовь_2628-15		Что ты Как он рассказывал тогда о любви!..	34:39	0:42
любовь	NOUN	1918	1918-1990	1918-1990_любовь_2646-15		Они не были людьми односторонними, но односторонней становилась их любовь, лишенная возможности естественного развития.	67:73	0:119
любовь	NOUN	1992	1992-2016	1992-2016_любовь_2637-15		Это есть в мемуарах близких -- о том, какой целительной силой обладала любовь Елены Сергеевны и ее неистовая вера в гениальность творения: "Дом их, словно назло всем враждебным стихиям, сиял счастьем и довольством!..	71:77	0:216
любовь	NOUN	1992	1992-2016	1992-2016_любовь_2619-15		(II) "Ночной город страшен, но я не боюсь, потому что храню в себе слово любви".	73:78	0:80
любовь	NOUN	1992	1992-2016	1992-2016_любовь_2635-15		И тогда настанет ваша пора доказать мне свою любовь.	45:51	0:52
любовь	NOUN	1992	1992-2016	1992-2016_любовь_2617-15		Но это ж не первая его любовь.	23:29	0:30
любовь	NOUN	1992	1992-2016	1992-2016_любовь_2607-15		Стена любви В Париже, на знаменитом Монмартре, появилась так называемая Стена любви.	6:11	0:84
любовь	NOUN	1992	1992-2016	1992-2016_любовь_2615-15		Я знаю даму, которая плачет над всякими слезливыми историями, тоже уверяет, что любовь превыше всего, но когда ее собственный сыночек захотел жениться на приезжей из Караганды, с мамочки сразу сошла дурь, она прекрасно поняла, что этой авантюристке нужна прописка и площадь в Петербурге, -- и встала стеной.	80:86	0:307
любовь	NOUN	1992	1992-2016	1992-2016_любовь_2629-15		Одни эпизоды здесь исполнены глубокого драматизма, другие -- имеют просветляющий, порой даже идиллический характер, запечатлевая жизненные зоны мира, любви, единения и гармонии.	150:155	0:177
любовь	NOUN	1992	1992-2016	1992-2016_любовь_2613-15		Отдельные, правда, крайне немногочисленные адепты данного жанра, еще недавно донашивавшие потертые джинсы, сегодня без тени смущения позируют на обложках глянцевых журналов на фоне роскошных вилл, яхт и прочих атрибутов красивой жизни, назойливо подчеркивая при этом свою любовь к правде, добру и справедливости.	272:278	0:312
любовь	NOUN	1992	1992-2016	1992-2016_любовь_2611-15		Приятно было осознавать, что у нее он был первой любовью.	49:56	0:57
любовь	NOUN	1992	1992-2016	1992-2016_любовь_2609-15		Тут по телевизору проводили блиц опрос -- что вы собираетесь подарить жене на восьмое марта Многие мужики на улице ответили очень серьезно: -- Ночь любви.	148:153	0:154
любовь	NOUN	1992	1992-2016	1992-2016_любовь_2631-15		Конечно бросали, после двух лет горячей любви.	40:45	0:46
любовь	NOUN	1992	1992-2016	1992-2016_любовь_2621-15		То же самое было с туристами в Италии и Швейцарии, Интурист называл эти поездки целевыми, т. е. рассчитанными на людей, которые по роду деятельности или из любви к спорту стремятся посетить спортивные соревнования.	156:161	0:214
любовь	NOUN	1992	1992-2016	1992-2016_любовь_2649-15		Ни у кого из тех, кто знал Тернавского, генерал любви не вызывал.	48:53	0:65
любовь	NOUN	1992	1992-2016	1992-2016_любовь_2627-15		Если для первых, "индустриальных", рабский труд зеков и инквизиторские методы насаждения народной любви к элите стали анахронизмом и тормозом, то для Мао, Кима и Ходжи внеэкономическое принуждение к работе и палочно-религиозная лояльность -- всё ещё служили главными инструментами "доиндустриального" социалистического строительства.	98:103	0:333
любовь	NOUN	1992	1992-2016	1992-2016_любовь_2647-15		Ни юной любви, на чужом диване преданной.	8:13	0:41
любовь	NOUN	1992	1992-2016	1992-2016_любовь_2603-15		Я думаю, девочка, что это любовь.	26:32	0:33
любовь	NOUN	1992	1992-2016	1992-2016_любовь_2601-15		Исключительно для, что называется, здоровья -- а любовь, какая наивность, любовь и не ночевала в этом обходительном лукавом медведе.	49:55	0:132
любовь	NOUN	1992	1992-2016	1992-2016_любовь_2633-15		Так вот, истинная любовь к мужу -- основное качество жены писателя.	18:24	0:67
любовь	NOUN	1992	1992-2016	1992-2016_любовь_2599-15		Тогда-то Лаура и поняла, что это любовь, и все сразу встало на свои места, потому что Уран догадался еще раньше, но крепился, не метил углы.	33:39	0:140
любовь	NOUN	1992	1992-2016	1992-2016_любовь_2639-15		Единственное, что меня все-таки огорчало, -- это то, что у Маши не до конца "отболела" эта любовь: она по-прежнему мрачнела, когда речь заходила о Леше, видно было, что для нее очень болезненна эта тема.	91:97	0:203
любовь	NOUN	1992	1992-2016	1992-2016_любовь_2595-15		Сценарий рассказывал о любви русской и китайца.	23:28	0:47
любовь	NOUN	1992	1992-2016	1992-2016_любовь_2651-15		Может быть, женственный мир вышел бы не таким озлобленным, как мужской, но также не исключено, что все было бы так, как было, и людьми руководили бы те же властолюбие, сребролюбие, ненависть и любовь.	193:199	0:200
любовь	NOUN	1992	1992-2016	1992-2016_любовь_2641-15		Этой модой мы обязаны уже английским дизайнерам, для которых любовь к Японии и Китаю еще с середины XVIII века стала чем-то вроде национальной традиции.	61:67	0:152
любовь	NOUN	1992	1992-2016	1992-2016_любовь_2623-15		Возможно, глупая баба проболталась подружкам, а те из-за большой любви к подруге донесли".	65:70	0:90
любовь	NOUN	1992	1992-2016	1992-2016_любовь_2625-15		Одна пятнадцатилетняя девчонка -- уверен, что невинная, -- торговала поцелуями по рублю за штуку, а за трешку оставляла у подростков на груди багряно-синие засосы, которые мы носили гордо, как ордена любви.	200:205	0:206
любовь	NOUN	1992	1992-2016	1992-2016_любовь_2643-15		И кто же прав: те деды-всеведы, которые знают, что Леонардо Ди Каприо -- хорошенький мальчик из богемной семьи, довольно артистичный, но столь же далекий от какого бы то ни было совершенства, как и мы с вами, возведенный безумной человеческой мечтой, алчущей зримых кумиров, в ранг Принца Человечества, или чистые наивные глаза девочек, отдающих первое золото сердца прекрасному миражу Ведь любовь, которую вызывает принц Лео, лишь в незначительной степени возвращается к нему.	391:397	0:477
любовь	NOUN	1992	1992-2016	1992-2016_любовь_2653-15		И культовское детство, вычитавшее из школы любую информацию, и осторожность матери, дрожавшей за свою социальную чуждость, и любовь матери, старавшейся оградить его от любых столкновений и любых препятствий на его так рано выявившемся звездном пути, и сам этот путь, сосредоточивший и занявший его настолько, что, даже когда его инфантильное поколение стало отравляться первыми глотками свежего воздуха, исторической перемены, он все еще не знал, ни что было, ни как стало, не ощутил никаких изменений, потому что и до и после существовал лишь в своем личном времени, да еще в глубоком past perfect.	125:131	0:599
любовь	NOUN	1992	1992-2016	1992-2016_любовь_2645-15		30 лет преданной любви и профессионального служения ландшафтной архитектуре, десятки осуществленных и пока не осуществленных проектов дают ему право иметь собственную точку зрения на профессию и высказывать ее публично.	17:22	0:219
любовь	NOUN	1992	1992-2016	1992-2016_любовь_2605-15		Диего мог гордиться фигурой второго плана: старик не отрывался от работы, он продолжал затесывать что-то широким плотницким топором, лишь один мимолетный взгляд бросил он на подросшего сына, помощника; взгляд, исполненный гордости и любви.	233:238	0:239
любовь	NOUN	1992	1992-2016	1992-2016_любовь_2597-15		И я старалась, чтобы эта любовь не проходила.	25:31	0:45
