lemma	pos	date	grouping	identifier	description	context	indexes_target_token	indexes_target_sentence	identifier_system	project	lang
любовник	NOUN	1700	1700-1916	1700-1916_любовник_2584		Телом он вял, хил и стар, а интеллектом ничем не отличается от толстой купчихи, которая только жрет, пьет, спит на перине и держит в любовниках своего кучера.	133:143	0:158	2584	rushifteval	ru
любовник	NOUN	1918	1918-1990	1918-1990_любовник_2585		А когда любовник начинал брать верх, она приговаривала: -- Поддай, поддай этому ревнивцу!	8:16	0:89	2585	rushifteval	ru
любовник	NOUN	1700	1700-1916	1700-1916_любовник_2586		Она, однако ж, ни на минуту не разнимала рук, коими опоясала его при смерти, и сухие кости любовника, осыпаемые её поцелуями, неоднократно проникались чувством сладчайшей неги.	91:100	0:176	2586	rushifteval	ru
любовник	NOUN	1918	1918-1990	1918-1990_любовник_2587		Но она была неопытна в любви, не знала, что любовник ждет знака, ожидает помощи и одобрения, если не решается удовлетворить свое огненное желание.	44:52	0:146	2587	rushifteval	ru
любовник	NOUN	1700	1700-1916	1700-1916_любовник_2588		Сердце Волынского не знало постоянной страсти, а после мгновенной ветрености он возвращался всегда пламенным любовником к ногам супруги.	109:119	0:136	2588	rushifteval	ru
любовник	NOUN	1918	1918-1990	1918-1990_любовник_2589		В духе Дюма пламенная любовь казака, прыжок с лошадью в Кубань, золотой кувшин с монетами, кувшин похищает у деда внучка, у нее похищает любовник, любовника убивают в гражданскую войну и т. д. Ха-ха.	137:145	0:199	2589	rushifteval	ru
