lemma	pos	date	grouping	identifier	description	context	indexes_target_token	indexes_target_sentence	identifier_system	project	lang
облако	NOUN	1918	1918-1990	1918-1990_облако_2954		Отблеск огней Эйдткунена, с одной стороны, и Вержболова, с другой, на облаках казался зловещим заревом.	70:77	0:103	2954	rushifteval	ru
облако	NOUN	1992	1992-2016	1992-2016_облако_2955		"Среди них -- миграция в публичные ""облака"" и аутсорсинг, виртуализация, внедрение средств бизнес-аналитики и информационной безопасности"", -- уточняет Борис Бобровников, генеральный директор компании КРОК."	35:41	0:205	2955	rushifteval	ru
облако	NOUN	1918	1918-1990	1918-1990_облако_2956		Порывистый северо-западный ветер прогонял сначала только немногие перистые облака, но затем и слоистые, густые, к полудню, когда мой разъезд уже был в дороге, окутавшие все небо и посыпавшие снегом.	75:81	0:198	2956	rushifteval	ru
облако	NOUN	1992	1992-2016	1992-2016_облако_2957		Оттуда вылетали облака голубого дыма и обрывки грохота.	16:22	0:55	2957	rushifteval	ru
облако	NOUN	1918	1918-1990	1918-1990_облако_2958		Оттого ли, что встретили их радушно, оттого ли, что стояли мягкие весенние дни, когда земля только-только просыхает, а над крутыми сопками торопливо бегут белые нежные облака, сквозь которые пробивается теплое яркое солнце, а только Нине и Леониду здесь сразу понравилось.	168:174	0:272	2958	rushifteval	ru
облако	NOUN	1992	1992-2016	1992-2016_облако_2959		За тобою -- прожитые дни, облака, встающие отвесно, все, чему в сознанье стало тесно, -- так раздвинь завесы и взгляни -- не туда, где были мы с тобой молодыми, смелыми, хмельными, а туда, где ранами сплошными изморщинен плещущий прибой.	26:32	0:237	2959	rushifteval	ru
облако	NOUN	1918	1918-1990	1918-1990_облако_2960		Потом все небо покрылось облаками, я не находил ни одной точки, чтобы верно держаться, и правил куда-то все влево, едва различая темнеющий берег.	25:33	0:145	2960	rushifteval	ru
облако	NOUN	1992	1992-2016	1992-2016_облако_2961		Закрыв глаза, обнял как облако или тонкое деревце.	24:30	0:50	2961	rushifteval	ru
облако	NOUN	1918	1918-1990	1918-1990_облако_2962		Но песни и юность прошли, как проходят легкие, чистые облака майской весны, чтобы вдруг исчезнуть и оставить после себя уверенное июльское солнце.	54:60	0:146	2962	rushifteval	ru
облако	NOUN	1992	1992-2016	1992-2016_облако_2963		Пассажиры самолета об этом еще не знали, а если бы знали, то едва ли смогли бы себе представить -- самолет летел над облаками, и в иллюминаторах, если приподнять заслонку, сияло безукоризненно голубое небо.	117:125	0:206	2963	rushifteval	ru
облако	NOUN	1918	1918-1990	1918-1990_облако_2964		За Азией давно уже числился не один десяток прогонов, а все еще трепетали платки на летевших головах, и переглядывались люди, и были гладкие и обросшие бородой, и летели все, в облаках крутившегося песку, летели и летели мимо все той же пыльной, еще недавно европейской, уже давно азиатской ольхи.	177:184	0:297	2964	rushifteval	ru
облако	NOUN	1992	1992-2016	1992-2016_облако_2965		Этот порыв ветра относит подол плаща Богоматери и раздувает платок на её голове, заставляет двигаться облака.	102:108	0:109	2965	rushifteval	ru
облако	NOUN	1918	1918-1990	1918-1990_облако_2966		Появление галосов объясняется преломлением и отражением идущих от светила лучей света в кристалликах льда перистых облаков.	115:122	0:123	2966	rushifteval	ru
облако	NOUN	1992	1992-2016	1992-2016_облако_2967		Опять над полем Куликовым Взошла и расточилась мгла, И, словно облаком суровым, Грядущий день заволокла.	63:70	0:104	2967	rushifteval	ru
облако	NOUN	1918	1918-1990	1918-1990_облако_2968		Ты, белка, недолюбливаешь меня, я знаю, и поэтому Лилиана Борисовна (то есть я) будет рассказывать о себе сама, а ты уж иди порезвись, попрыгай с ветки на ветку, взбирайся на самую тоненькую крестовинку-маковку елки и оттуда бросайся в голубоватую пустоту, растопырив лапки и распушив хвост, падай, цепляйся на лету за гибкую, податливую вершину молодой березки и, спружинив на ней почти до самой земли, прыгай на кочку, оттуда на кустик орешника, с куста на долговязую сосенку -- и снова пулею вверх, к синему небу и белым облакам.	524:531	0:532	2968	rushifteval	ru
облако	NOUN	1992	1992-2016	1992-2016_облако_2969		Затем часть этого облака отвисает книзу в виде гигантской воронки, которая всё более удлиняется и наконец достигает поверхности земли или воды.	18:24	0:143	2969	rushifteval	ru
облако	NOUN	1918	1918-1990	1918-1990_облако_2970		Минута в облаке отнимает день жизни.	9:15	0:36	2970	rushifteval	ru
облако	NOUN	1992	1992-2016	1992-2016_облако_2971		Приглашаем читателей журнала участвовать в конкурсе на лучшие фотографии облаков, в которых виден сюжет: очертания предметов, животных, людей и тому подобное.	73:80	0:158	2971	rushifteval	ru
облако	NOUN	1918	1918-1990	1918-1990_облако_2972		Не ограничиваясь применением дыма, т. Федосеев и его сотрудники упорно работали над подысканием такого химического вещества, которое было бы в состоянии уничтожать облака.	164:170	0:171	2972	rushifteval	ru
облако	NOUN	1992	1992-2016	1992-2016_облако_2973		Тихая российская провинция, избы с наличниками, колодцы, дровяники, яблоневые сады, копошащиеся в пыльной траве куры, обрывистый волжский берег, небо да облака.	153:159	0:160	2973	rushifteval	ru
облако	NOUN	1918	1918-1990	1918-1990_облако_2974		Над каналом, над куполами Спаса-на-крови -- большое, светлое облако.	61:67	0:68	2974	rushifteval	ru
облако	NOUN	1992	1992-2016	1992-2016_облако_2975		Атмосфера Земли пропускает в космос около 10% собственного теплового излучения, оставшиеся 27% поглощают облака и молекулы других парниковых газов, в первую очередь метан.	105:111	0:171	2975	rushifteval	ru
облако	NOUN	1918	1918-1990	1918-1990_облако_2976		Впереди в облаках пыли с грохотом скачут по накатанной дороге телеги.	10:17	0:69	2976	rushifteval	ru
облако	NOUN	1992	1992-2016	1992-2016_облако_2977		"Распознавание речи осуществляется в ""облаке"", то есть на веб-сервере, к которому постоянно подключен смартфон с приложением TransTalk. правда, военные относятся к облачным сервисам без энтузиазма, потому что обеспечить Интернет в пустыне, например, не так-то просто."	37:43	0:266	2977	rushifteval	ru
облако	NOUN	1918	1918-1990	1918-1990_облако_2978		"И в небе чудилось осмысленное, но тоже тайное движение облаков, а может быть, иных миров иль ""ангелов крыла""!"	55:62	0:109	2978	rushifteval	ru
облако	NOUN	1992	1992-2016	1992-2016_облако_2979		Было жарко, но к вечеру небо заволокли густые белые облака.	52:58	0:59	2979	rushifteval	ru
облако	NOUN	1918	1918-1990	1918-1990_облако_2980		Оно не испарилось, не исчезло в синеве до сих пор; по-прежнему в августе белая гора возвышается над старым деревенским аэродромом, над многоэтажными домами, над излучиной реки, одетой в гранит, чуть заметно под напором западного ветра передвигаясь к востоку, к центру Москвы, и вслед за облаком медленно передвигается точно такая же, как когда-то, легчайшая прозрачная тень, и машины внизу то ныряют в эту прозрачность, то выскакивают на солнцепек, сверкая черными и салатными лакированными частями, летя серебряной дугою шоссе в Шереметьево, в Лондон, в Вену, в Бомбей, в Куала-Лумпур.	287:294	0:586	2980	rushifteval	ru
облако	NOUN	1992	1992-2016	1992-2016_облако_2981		Я хорошо помню, детьми мы играли около совхозной бойни, и я хорошо помню озера крови, над которой плотным звенящим облаком висел гнус.	115:122	0:134	2981	rushifteval	ru
облако	NOUN	1918	1918-1990	1918-1990_облако_2982		Потом они все вместе исчезли за облаками, а бомбардировщики продолжали с ревом пикировать на мост, в который они, кажется, никак не могли попасть.	32:40	0:146	2982	rushifteval	ru
облако	NOUN	1992	1992-2016	1992-2016_облако_2983		Косматые облака, шевелясь и вскипая, неслись туда, где за каменным гребнем остались родные и надёжные деревянные крепости с крестами на башнях.	9:15	0:143	2983	rushifteval	ru
облако	NOUN	1918	1918-1990	1918-1990_облако_2984		Если исходить из предположения, что вещество солнечной системы произошло не из раскаленного плазменного облака, а из холодной космической пыли, то это облако могло нагреться до температуры, равной примерно 2000C (при давлении 1000 атмосфер), под действием мощной ударной волны, возникшей при вспышке на Солнце.	104:110	0:310	2984	rushifteval	ru
облако	NOUN	1992	1992-2016	1992-2016_облако_2985		Далеко впереди, если как следует вглядеться, сверкали белые пятна -- то ли вечные снега на горных вершинах, то ли облака, освещенные снизу солнцем.	114:120	0:147	2985	rushifteval	ru
облако	NOUN	1918	1918-1990	1918-1990_облако_2986		Он не прикрыт грядами облаков, на нем не увидишь ни резко очерченных материков, ни безбрежной глади океанов, ни голубых пятен озер, ни ленточек рек.	22:29	0:148	2986	rushifteval	ru
облако	NOUN	1992	1992-2016	1992-2016_облако_2987		"В романе ""Черное облако"" он описал появление вблизи Земли гигантского межзвездного облака, наделенного разумом, способностью к целеустремленному движению и бессмертием."	17:23	0:168	2987	rushifteval	ru
облако	NOUN	1918	1918-1990	1918-1990_облако_2988		Ласточки с визгом прорезали белизну облака.	36:42	0:43	2988	rushifteval	ru
облако	NOUN	1992	1992-2016	1992-2016_облако_2989		Достигнув окрестности планеты, расширившееся магнитное облако обтекает магнитосферу Земли по границе (магнитопаузе), поскольку магнитное поле не пускает заряженные частицы плазмы внутрь.	55:61	0:186	2989	rushifteval	ru
облако	NOUN	1918	1918-1990	1918-1990_облако_2990		"События проходили над нею, точно облака и, касаясь ее, как тени облаков, не омрачали настроения; спокойно сообщив: ""Лидия рассказывает, будто Государственный Совет хотели взорвать."	33:39	0:180	2990	rushifteval	ru
облако	NOUN	1992	1992-2016	1992-2016_облако_2991		Следующий вопрос: какое влияние оказывают облака на климат Понятно, что облака, с одной стороны, не выпускают в космос тепло, идущее от Земли, и этим способствуют потеплению, а с другой стороны, они отражают тепло, идущее на Землю от Солнца, и этим способствуют охлаждению.	42:48	0:273	2991	rushifteval	ru
облако	NOUN	1918	1918-1990	1918-1990_облако_2992		Сквозь тяжёлые облака табачного дыма блеснул огонь выстрела.	15:21	0:60	2992	rushifteval	ru
облако	NOUN	1992	1992-2016	1992-2016_облако_2993		-- Пойми, пирамида власти уходит за облака, её вершина ей не принадлежит.	36:42	0:73	2993	rushifteval	ru
облако	NOUN	1918	1918-1990	1918-1990_облако_2994		Подойдя к окну, он видел темные низкие облака, блестящую улицу, зеленоватый свет фонаря на углу, но и это было теперь нужно и не щемило сердце.	39:45	0:143	2994	rushifteval	ru
облако	NOUN	1992	1992-2016	1992-2016_облако_2995		Это и табачный дым, а также черные облака, которые стелятся за автобусами.	35:41	0:74	2995	rushifteval	ru
облако	NOUN	1918	1918-1990	1918-1990_облако_2996		Среди прозрачнейших, беспыльных окрестностей молотильный сарай всегда был окружен облаком слегка светящейся на солнце пыли.	82:89	0:123	2996	rushifteval	ru
облако	NOUN	1992	1992-2016	1992-2016_облако_2997		Под грозовым облаком плотность наведенных на земле положительных зарядов может значительно возрастать, а напряженность электрического поля -- превышать 100 кВ/м, в 1000 раз больше ее значения в хорошую погоду.	13:20	0:209	2997	rushifteval	ru
облако	NOUN	1918	1918-1990	1918-1990_облако_2998		Облака летят низко, -- метров на 300.	0:6	0:37	2998	rushifteval	ru
облако	NOUN	1992	1992-2016	1992-2016_облако_2999		И сам увидел, как облаков действительно померкнули края.	18:25	0:56	2999	rushifteval	ru
облако	NOUN	1918	1918-1990	1918-1990_облако_3000		Что же касается мощного облачного покрова, то он оказался лишь внешне похожим на земные облака.	88:94	0:95	3000	rushifteval	ru
облако	NOUN	1992	1992-2016	1992-2016_облако_3001		"Оранжевое пламя захлестнуло ""муравейник"", вверх взметнулось смоляное облако, новые взрывы окружили его со всех сторон, и он сдулся, рухнул, испустив усталый предсмертный стон, потом его заволокло густым дымом горящего леса и плоти."	69:75	0:231	3001	rushifteval	ru
облако	NOUN	1918	1918-1990	1918-1990_облако_3002		Когда их положили лицом вверх, Сергей Петрович увидел осколок голубого неба с белыми простоквашными облаками и яркие паруса бригов.	100:108	0:131	3002	rushifteval	ru
облако	NOUN	1992	1992-2016	1992-2016_облако_3003		Ветер гонял облака, гремел крышей, толсто выл трубой и тонко свистел щелями.	12:18	0:76	3003	rushifteval	ru
облако	NOUN	1918	1918-1990	1918-1990_облако_3004		Девушка в модной пилотке шла ей навстречу в облаке духов, как в отдельном, красиво пахнущем мире, отгороженная этим облаком от всех остальных людей и в то же время одаривая этих остальных своими духами.	44:50	0:202	3004	rushifteval	ru
облако	NOUN	1992	1992-2016	1992-2016_облако_3005		В гардеробной сгустилось фиолетовое облако.	36:42	0:43	3005	rushifteval	ru
облако	NOUN	1918	1918-1990	1918-1990_облако_3006		"Граница Запада с Востоком, Севера с Югом, Азии с Европой, смешение православия с магометанством, истошные крики мулл и греческие песнопения христиан, кровь, месть, разбой, захват, подавление, рабство и насмешливый шепот господина ван Шонховена: ""Это вы мне обещали, безумец, когда отрывали меня от финских хладных скал и спасали из гранитного заточения.."" Раскаленные голые скалы, нависшие над головами; внезапно -- прохладный ветер, внезапно -- родниковая вода из запотевшего кувшина, какая-то бескрайняя неправдоподобная изумрудная долина, мерцающая в разрывах облаков где-то на страшной глубине; гранитный крест ермоловских времен, печеная форель на гигантских листьях лопуха, нечастые приземистые харчевни, именуемые духанами, горький дух от прелого прошлогоднего кизила и умопомрачительный аромат из винных бочек."	563:570	0:818	3006	rushifteval	ru
облако	NOUN	1992	1992-2016	1992-2016_облако_3007		Благодаря своей способности мысленно переноситься следом за взглядом, Катерина Ивановна как бы прислонялась к незнакомцу, чуть ли не прижималась к нему и оставалась с ним, даже когда убегала в смятении перед своим бесстыдством, пугаясь луж и отраженных, не совпадавших с лужами по форме белых облаков.	293:300	0:301	3007	rushifteval	ru
облако	NOUN	1918	1918-1990	1918-1990_облако_3008		После ухода секретаря было еще время, и Фуст отыскал в чемодане карту, которую нашел не сразу, так как она была засунута меж шерстяных вещей, носков, свитеров и варежек, и, разложив ее, долго смотрел с таким пристальным вниманием, как будто он видел не нарисованные условные обозначения гор, рек и ледников, а настоящие ущелья, перевалы и вершины, выходящие из облаков.	361:368	0:369	3008	rushifteval	ru
облако	NOUN	1992	1992-2016	1992-2016_облако_3009		Говорят, что по замыслу зодчих он должен был возвышаться над облаками.	61:69	0:70	3009	rushifteval	ru
облако	NOUN	1918	1918-1990	1918-1990_облако_3010		Солнце всходило, но вместе с ним с востока шли облака, и как-то не светлело.	47:53	0:76	3010	rushifteval	ru
облако	NOUN	1992	1992-2016	1992-2016_облако_3011		Этот астрономический свет, словно не знающий покрова облаков, давал увидеть над простертым ветераном легкую дымку небытия, состоявшую, должно быть, из той самой светлой пыли бессмертия, с которой не стоило бороться при помощи щетки и тряпки.	53:60	0:241	3011	rushifteval	ru
облако	NOUN	1918	1918-1990	1918-1990_облако_3012		Скоро воздушный шар поднялся выше, вылетел из облаков и полетел над ними.	46:53	0:73	3012	rushifteval	ru
облако	NOUN	1992	1992-2016	1992-2016_облако_3013		"В варианте ""облака"" заправочная станция должна представлять собой самостоятельный автоматический космический аппарат."	12:18	0:117	3013	rushifteval	ru
