lemma	pos	date	grouping	identifier	description	context	indexes_target_token	indexes_target_sentence	identifier_system	project	lang
лишение	NOUN	1992	1992-2016	1992-2016_лишение_2469		"-- Господин Корти, расцениваете ли вы указ Путина о лишении ""Свободы"" привилегий как предостережение То есть, что отношение правительства к вашей радиостанции может ужесточиться -- Моя интерпретация этого шага Путина такова."	53:60	0:224	2469	rushifteval	ru
лишение	NOUN	1918	1918-1990	1918-1990_лишение_2470		(Этот вопрос, как правило, рассматривается Президиумом только при обращении заинтересованной стороны.) Материал на остальных семнадцать человек был затем рассмотрен на Совещании, и хотя в отношении их не было обращений заинтересованных лиц, в Президиуме Верховного Совета СССР возникло предложение об отмене решения о лишении этих людей наград.	318:325	0:344	2470	rushifteval	ru
лишение	NOUN	1992	1992-2016	1992-2016_лишение_2471		"В соответствии со ст. 138 УК РФ ""незаконное производство, сбыт или приобретение в целях сбыта специальных технических средств, предназначенных для негласного получения информации"" грозит помимо штрафов (200--500 МРОТ) ограничением свободы на срок до трех лет либо ее лишением на тот же срок."	270:278	0:291	2471	rushifteval	ru
лишение	NOUN	1918	1918-1990	1918-1990_лишение_2472		И возвращаются ветры на круги своя Путь мой пролег поперек всей России -- от Печорской тайги до предгорий Арарата -- России 1944 года, втянутой в четвертый страшный год войны, притерпевшейся к лишениям, придавленной двойным гнетом войны и произвола, нашедшего дополнительное оправдание в необходимостях военного времени.	193:201	0:320	2472	rushifteval	ru
лишение	NOUN	1992	1992-2016	1992-2016_лишение_2473		Или -- до лишения его царского сана, развенчания.	10:17	0:49	2473	rushifteval	ru
