lemma	pos	date	grouping	identifier	description	context	indexes_target_token	indexes_target_sentence
штаб	NOUN	1992	1992-2016	1992-2016_штаб_6371-16		На Булевом болоте фашисты устроили бомбежку, хотели уничтожить штаб, радиоузел.	63:67	0:79
штаб	NOUN	1992	1992-2016	1992-2016_штаб_6331-16		Петроградского военного округа В исполнение директивы Президиума Петросовета, Чрезвычайная Тройка, которой поручено организовать в Петрограде празднование 1-го Мая, в день открытия 2-го Конгресса III Интернационала, настоящим просит вас предоставить в распоряжение Начальника Главного штаба Тройки под его личную ответственность 1200 человек (приблизительно) разных родов войск Красной Армии (список прилагается) в полном походном обмундировании, вместе с краскомами и частями артиллерии, а также три аэроплана, два эскадренных миноносца, восемь броневиков и пушки Петропавловской крепости (для производства залпов).	285:290	0:616
штаб	NOUN	1992	1992-2016	1992-2016_штаб_6369-16		-- Жора, мне надо побывать в штабе, но об этом никто не должен знать.	29:34	0:69
штаб	NOUN	1992	1992-2016	1992-2016_штаб_6341-16		Летом 1916 года начальник штаба верховного главнокомандующего генерал М.В. Алексеев предложил сосредоточить снабжение, продовольствие и транспорт в руках одного человека с диктаторскими полномочиями, но ни Дума, ни Штюрмер этого не желали, и вопрос "замотали".	26:31	0:260
штаб	NOUN	1992	1992-2016	1992-2016_штаб_6347-16		Протянул старшему сержанту, какой с ним: -- Отдашь начальнику штаба.	62:67	0:68
штаб	NOUN	1992	1992-2016	1992-2016_штаб_6329-16		Там же был забавный эпизод, когда в землянку, где оживленно беседовали Эткинд, Левин и еще несколько "политических" майоров, с двумя солдатами вошел капитан -- комендант штаба, и, указывая на буржуйку, сказал: -- Убрать!	170:175	0:220
