lemma	pos	date	grouping	identifier	description	context	indexes_target_token	indexes_target_sentence
штаб	NOUN	1700	1700-1916	1700-1916_штаб_6336-16		Но как забилось мое сердце, когда я узнал, что в тот же день меня причислили к штабу Суворова.	79:84	0:94
штаб	NOUN	1700	1700-1916	1700-1916_штаб_6320-16		Он пришел сюда, на Самбур, и занемог крепко со всем штабом и домом своим от мала до велика -- доказательство благорастворенного здешнего климата.	52:58	0:145
штаб	NOUN	1700	1700-1916	1700-1916_штаб_6318-16		Получено из штаба известие о заключении перемирия до ратификации мирного договора.	12:17	0:82
штаб	NOUN	1700	1700-1916	1700-1916_штаб_6314-16		Что нового в войсках Их Императорское Высочество Августейший Главнокомандующий войсками гвардии Петербургского военного округа Великий Князь Николай Николаевич, после переезда 3 июля в Красное Село и принятия командования над войсками красносельского лагерного сбора, ежедневно выезжал в поле на занятия войск, в сопровождении начальника штаба округа и лагерного обора, очередного офицера генерального штаба, штаба округа и дежурного адъютанта.	338:343	0:444
штаб	NOUN	1700	1700-1916	1700-1916_штаб_6358-16		И так уж от военных неудач на душе было невесело, а тут еще погода стояла отвратительная; моросивший дождик успел вымочить меня за время переезда от Парадима до зотовского штаба.	172:177	0:178
штаб	NOUN	1700	1700-1916	1700-1916_штаб_6316-16		Пред обедом мы ходили в магазейны английский, часовой, с бронзовыми и мраморными вещами, а вечером в комнатах Главного штаба смотрели освещение газом.	119:124	0:150
штаб	NOUN	1700	1700-1916	1700-1916_штаб_6346-16		Он тотчас потребовал меня в штаб.	28:32	0:33
штаб	NOUN	1700	1700-1916	1700-1916_штаб_6372-16		Кажется, 12-го апреля я, зайдя утром в штаб в отделение генерал-квартирмейстера, узнал, что противник крупными массами перешел на Манычском фронте в наступление, форсировал Маныч и продолжал наступление на Торговую.	39:43	0:215
штаб	NOUN	1700	1700-1916	1700-1916_штаб_6370-16		На 3-й день, т.-е. 15-го числа, прибыл резервный баталион; поселяне, почувствуя несказанную робость, оставили меня в безопасности, спокойно допустили отцу моему, села Маркова дьячку Павлу Константинову, приехавшему погребать меня, взять и везти меня в свой дом, но опасаясь быть в оном, я два дня и две ночи безвыходно провел в церкви, где получив уведомление от старшины села Коломны Мелентия Дмитриева, что поселяне коломенские раскаяваются, что меня не убили, я уехал в штаб деревню Перегино под покровительство командира резервного баталиона г. майора Толмачева, но, получив и здесь уведомление от жены моей, что поселяне, надеясь на измену резерва, готовятся сделать новое нападение на штаб, вынужден был, испрося у г. Толмачева конвой, отправиться к своему отцу в село Маркове.	473:477	0:783
штаб	NOUN	1700	1700-1916	1700-1916_штаб_6368-16		Его имя стало особенно популярным со времени нашей смуты, когда сперва в должности начальника штаба верховного главнокомандующего, а затем главнокомандующего юго-западного фронта, он независимо, смело и твердо подымал голос свой на защиту чести и достоинства родной армии и русского офицерства.	94:99	0:294
штаб	NOUN	1700	1700-1916	1700-1916_штаб_6366-16		Он знал Левашова как полковника генерального штаба и как довольно видную личность в литературе; с Александром Прохоровым его личное знакомство ограничивалось покуда одной встречей.	45:50	0:180
штаб	NOUN	1700	1700-1916	1700-1916_штаб_6364-16		В 9 1/2 приехал в Могилев -- был встречен съехавшимися главнокомандующими и их начальн. штабов.	88:94	0:95
штаб	NOUN	1700	1700-1916	1700-1916_штаб_6362-16		Затем было длинное совещание с вызванными из разных округов офицерами Генерального штаба относительно временных мер к скорейшему, в случае нужды, снабжению войск лошадьми.	83:88	0:171
штаб	NOUN	1700	1700-1916	1700-1916_штаб_6360-16		Один из адъютантов доложил коменданту, что начальник главного штаба неотступно требует от караульного офицера, чтобы тот выпустил Караджу, и грозит, что ему достанется, если он не исполнит этого требования.	62:67	0:206
штаб	NOUN	1700	1700-1916	1700-1916_штаб_6350-16		Вот этот результат: 1) Lamartine 250800 2) Duport (de l"Eure) 245983 3) F. Arago 243640 4) Garnier-Pags 240890 Правительство 5) Marrast 229166 6) Marie 225776 7) Crmieux 210699 8) Branger 204271 Песенник 9) Carnot 195638 министр 10) Bettemont 189252 то же 11) Duvivier 182252 генерал de la garde mobile 12) Lasteyrie 165156 из старой оппозиции 13) Vavin 151003 то же и покровитель поляков 14) Cavaignac 144127 из "National", начальник Алжира 15) Berger 136660 из старой оппозиции и мэр II квартала 16) Pagnerre 136117 из "National", книгопродавец 17) Buchez 135678 основатель "Atelier", католический демократ 18) Carmenin 135 050 памфлетист и редактор декрета о всеобщих выборах 19) Carbon 135045 работник из "Atelier", помощник мэра 20) Caussidier 133779 префект полиции 21) Albert 133 работник из Правительства 22) Wolowsky 132353 экономист старой школы 23) Peupin 132353 из "Atelier", работник 24) Ledru Rollin 131567 член Правительства!! 25) Schmit 124383 ложный работник 26) Flocon 121865 член Правительства!! 27) Lous Blanc 121140 член Правительства!! 28) Recurt 118075 медик из "National" 29) Rerdignier 117290 работник, автор книги "du campagnonage" 30) Bastide 110928 редактор из "National" 31) Cognerel 109934 протестантский пастор 32) Garnon 106747 33) Guinard 106262 начальник штаба национальной гвардии 34) Lamenais 104 871 Из результатов оказалось: Ламартин в качестве главы умеренной партии получил страшное число -- 260 т. голосов, в депутаты вводится старая династическая оппозиция короля Лудвига-Филиппа, из работников принимаются только работники-аристократы "Atelier", допускаются два либеральных священника (Когнерель, Ламенэ), вся социальная партия отстраняется без исключения, даже та умеренная, которой покровительствовал "National" [наконец, члены Правительства], решительно демократическая -- тоже, наконец 4 члена Правительства, представляющие движение, получают обидное меньшинство голосов и, видимо, только из опасения произвести междоусобную войну исключением их, но генерал Куртэ, главноначальствующий национальной гвардией, исключается без милости за одно слово, может быть, им сказанное: "Je veux tre le gnral du peuple".	1289:1294	0:2154
штаб	NOUN	1700	1700-1916	1700-1916_штаб_6352-16		Начальник штаба, которого севастопольцы прозвали за его немецкий формализм и страсть к переписке "бумажным генералом" и "старшим писарем", низенький, прилизанный, не считавший себя вправе даже выразить какое-нибудь свое мнение, -- докладывал главнокомандующему о словах перебежчиков и донесениях с "секретов".	10:15	0:309
штаб	NOUN	1700	1700-1916	1700-1916_штаб_6348-16		В мае встречаюсь под аркою главного штаба с Огрицкою.	36:41	0:53
штаб	NOUN	1700	1700-1916	1700-1916_штаб_6356-16		Движение эшелонов было распределено таким образом: первый эшелон, под начальством генерального штаба подполковника Скобелева, шел, обыкновенно, с 3 до 9 часов утра и с 4 до 8 вечера; второй, начальником которого был генерального штаба подполковник Гродеков, шел с 4 до 8 вечера и с 3 до 9 часов утра; наконец, третий, под начальством генерального штаба подполковника Пожарова шел, как и первый эшелон, с 3 до 9 утра и с 4 до 8 вечера.	95:100	0:434
штаб	NOUN	1700	1700-1916	1700-1916_штаб_6322-16		Начальник штаба флота капитан 1-го ранга Машуков пошел в Керчь на ледоколе "Гайдамак", с ним только что прибывший из Константинополя транспорт "Россия" для принятия части войск с барж, перегруженных до крайности.	10:15	0:212
штаб	NOUN	1700	1700-1916	1700-1916_штаб_6344-16		Кроме того, начальник Главного штаба уведомил губернатора о всемилостивейше назначенной вдове Данилова пожизненной пенсии из государственного казначейства, по сто двадцати рублей в год.	31:36	0:185
штаб	NOUN	1700	1700-1916	1700-1916_штаб_6354-16		Сахарова в главный штаб от 14-го августа На южном фронте 13-го августа наши передовые части и авангарды медленно отходили, задерживаясь, к укрепленным позициям у Аньшанчжана.	19:23	0:174
штаб	NOUN	1700	1700-1916	1700-1916_штаб_6340-16		Я предупредил генерала Науменко, что на следующий день буду в войсковом штабе, где прошу начальника штаба сделать доклад по намеченным штабом мобилизации и формированиям, и что прошу к этому времени прибыть в штаб его, генерала Науменко, генерала Улагая и генерала Шкуро.	72:77	0:271
штаб	NOUN	1700	1700-1916	1700-1916_штаб_6342-16		Перодическе сроки для этихъ сообщенй главнаго штаба министерству иностранныхъ длъ не опредлялись.	46:51	0:97
штаб	NOUN	1700	1700-1916	1700-1916_штаб_6326-16		С затаенной мыслью принять на себя возможно опасные поручения, ехал Савин в корпусный штаб.	86:90	0:91
штаб	NOUN	1700	1700-1916	1700-1916_штаб_6332-16		Во-первых, он был с последним в родстве, пользовался полным его доверием и ему обязан последующей карьерой; тогда как у Ермолова Грибоедов составлял только роскошную обстановку его штаба, был умным и едким собеседником, что Ермолов любил, но никогда не был к нему близким человеком, как к Паскевичу.	181:186	0:299
штаб	NOUN	1700	1700-1916	1700-1916_штаб_6328-16		На беду свою, он стал обходиться с давнишним товарищем своим, К.Ф.Толем, по-старинному, а Толь был в то время генерал-адъютантом и генерал-квартирмейстером Главного штаба.	165:170	0:171
штаб	NOUN	1700	1700-1916	1700-1916_штаб_6334-16		Признаюсь, я сильно встосковался по моем милом Василии Павловиче и с нетерпением ожидал приезда полкового командира в штаб полка, чтобы отпроситься в свой эскадрон, расположенный по Дерптско-Рижской дороге, верстах в двух вправо от второй от Дерпта почтовой станции, -- на мызе Аякар, принадлежавшей барону Энгардту.	118:122	0:316
штаб	NOUN	1700	1700-1916	1700-1916_штаб_6330-16		Идея этой организации принадлежит офицеру прусского генерального штаба, ныне знаменитому фон-Мольтке, а приведение ее в исполнение, преимущественно по артиллерии, возложено было на прусского артиллерийского офицера Куцковского.	65:70	0:227
штаб	NOUN	1700	1700-1916	1700-1916_штаб_6324-16		Произведя 28-го августа смотр черноморскому флоту и оставшись вполне довольным блестящим состоянием судов и бодрым видом команд, Государь Император приказал объявить Высочайшую благодарность контр-адмиралу Бострему, Саннарскому и барону Нолькену, Монаршее благоволение начальникам -- штаба флота Миаковскому и первого дивизиону миноносцев Акимову, командиру порта Шарыгину и штаб- и обер-офицерам стоящих на рейде судов Царское "спасибо" нижним чинам.	284:289	0:451
штаб	NOUN	1700	1700-1916	1700-1916_штаб_6338-16		Начальником штаба Барятинского был предположен генерал Обручев, бывший начальник штаба военного министерства; начальником тыла армии был предположен генерал Анненков; тогда же предложили мне, на случай войны занять место начальника железнодорожных сообщений, на что я согласился.	12:17	0:279
штаб	NOUN	1992	1992-2016	1992-2016_штаб_6361-16		С 1976 по 1994 служил в военно-морском флоте, дослужился до замначальника штаба базы Балтийского флота.	74:79	0:103
штаб	NOUN	1992	1992-2016	1992-2016_штаб_6367-16		Доложил генерал Посредников (начальник штаба воздушной армии): минирование производить небезопасно -- очень плотная облачность, надо ждать погоды.	39:44	0:146
штаб	NOUN	1992	1992-2016	1992-2016_штаб_6359-16		А запрет на публикацию любых предвыборных материалов, не оплаченных из избирательных фондов, приводит к комическим ситуациям: представители некоторых изданий, получив реальное письмо читателя, ищут "крышу" -- штаб кандидата, от имени которого его можно было бы опубликовать.	209:213	0:274
штаб	NOUN	1992	1992-2016	1992-2016_штаб_6337-16		Естественно, основные командные посты и более 60 проц. других должностей в штабе корпуса при этом занимают представители данной страны.	75:80	0:135
штаб	NOUN	1992	1992-2016	1992-2016_штаб_6351-16		То, что Армада, второй человек в Генеральном штабе, предложил королю, что прибудет во дворец для доклада, было совершенно в порядке вещей.	45:50	0:138
штаб	NOUN	1992	1992-2016	1992-2016_штаб_6335-16		В августе 1999-го в бою возле одного из селений Ботлихского района отошел в мир иной "правая рука" Однорукого Ахмеда -- начальник штаба так называемой ваххабитской армии -- Хабиб.	130:135	0:179
штаб	NOUN	1992	1992-2016	1992-2016_штаб_6353-16		Основными направлениями развития СВ являются: повышение уровня общевойсковой и специальной подготовки личного состава; интенсификация оперативной и боевой подготовки штабов и войск; освоение частями и подразделениями способов и методов ведения боевых действий в различных условиях местности (равнина, лесные массивы, горы); оптимизация оргштатной структуры и системы управления войсками; отработка взаимодействия с сухопутными войсками вооруженных сил дружественной Сирии.	166:172	0:472
штаб	NOUN	1992	1992-2016	1992-2016_штаб_6333-16		По этим вопросам мы внесли представление начальнику Генерального штаба.	65:70	0:71
штаб	NOUN	1992	1992-2016	1992-2016_штаб_6355-16		Особую пикантность обсуждению придавал тот факт, что Сосковец впервые предстал перед широкой публикой в своем новом качестве -- руководителя штаба по выборам президента России.	141:146	0:176
штаб	NOUN	1992	1992-2016	1992-2016_штаб_6357-16		На следующий день двое членов избирательного штаба Чубайса были арестованы, когда они выносили коробку с бумагой для ксерокса.	45:50	0:126
штаб	NOUN	1992	1992-2016	1992-2016_штаб_6349-16		Осенью 1942 года, когда Севостьянов стал начальником штаба бригады, Голицын занял его место начальника разведки.	53:58	0:112
штаб	NOUN	1992	1992-2016	1992-2016_штаб_6363-16		Один из лам, состоявших при штабе нашей бригады, всерьез уверял меня, что вот уже несколько десятилетий агенты Ригден-Джапо тайно действуют во всех европейских столицах, направляя ход истории в нужное русло.	28:33	0:207
штаб	NOUN	1992	1992-2016	1992-2016_штаб_6325-16		Их отправили проехаться по местным предвыборным штабам кандидатов.	48:54	0:66
штаб	NOUN	1992	1992-2016	1992-2016_штаб_6365-16		Досье оперативного штаба объединенной группировки "Дудаевские боевики, переодетые в форму российских военнослужащих, ведут обстрел колонн беженцев, покидающих Грозный.	19:24	0:167
штаб	NOUN	1992	1992-2016	1992-2016_штаб_6321-16		По-видимому, следуя собственной логике, полковник по-своему истолковал визит офицера российского генерального штаба и заговорил первым: -- Я действительно рад, что вы пришли, господин Дорохов.	110:115	0:192
штаб	NOUN	1992	1992-2016	1992-2016_штаб_6319-16		Сменил Рабина на посту начальника Генерального штаба (1968-1972).	47:52	0:65
штаб	NOUN	1992	1992-2016	1992-2016_штаб_6327-16		Да и наш Толстой в "Севастопольских рассказах" заметил, что сводки командиров и с одного бастиона могут быть взаимоисключающими и что истории войн, писанные в штабах на основании этих донесений, не имеют ничего общего с реальностью.	159:165	0:232
штаб	NOUN	1992	1992-2016	1992-2016_штаб_6317-16		Роув назначен начальником оперативного управления штаба Северного объединенного командования (авиабаза Петерсон, штат Колорадо).	50:55	0:128
штаб	NOUN	1992	1992-2016	1992-2016_штаб_6315-16		Оперативный дежурный штаба Потийской ВМБ не стал докладывать командиру базы о вероятных визитерах с широчайшими полномочиями, поскольку никакого донесения или рапорта об их присутствии не существовало.	21:26	0:201
штаб	NOUN	1992	1992-2016	1992-2016_штаб_6323-16		Где искать ракетчиков Я добыла машину с помощью братьев-журналистов из военной газеты и помчалась в штаб.	100:104	0:105
штаб	NOUN	1992	1992-2016	1992-2016_штаб_6339-16		Прежде всего, после снятия осады Ленинграда к нам перебросили с Волховского фронта часть его штаба.	93:98	0:99
штаб	NOUN	1992	1992-2016	1992-2016_штаб_6345-16		Вскоре Хамди был убит в доме начальника генерального штаба Гашими.	53:58	0:66
штаб	NOUN	1992	1992-2016	1992-2016_штаб_6373-16		В 1919--1921 годах -- начальник оперативного управления, начальник штаба и временный командующий 16-й армией.	67:72	0:109
штаб	NOUN	1992	1992-2016	1992-2016_штаб_6343-16		Пока я спал, штаб родил новый план.	13:17	0:35
