lemma	pos	date	grouping	identifier	description	context	indexes_target_token	indexes_target_sentence	identifier_system	project	lang
частица	NOUN	1918	1918-1990	1918-1990_частица_6235		Ни в физике (гравитация, общая система элементарных частиц, управление термоядерными процессами), ни в математике (полная математизация других наук), ни в кибернетике (обещавшей так много -- от автомата -- шахматного гроссмейстера до передачи человека на расстояние, то есть создания его дубликата), ни в биологии (управление наследственностью, создание различных форм жизни в лабораторных условиях), ни в медицине (победа над раком) -- ни в одной области нет пока быстрого прогресса, напрасны были надежды ожидавших его.	52:58	0:521	6235	rushifteval	ru
частица	NOUN	1700	1700-1916	1700-1916_частица_6236		Количество частиц св. мощей приготовляется соответственно числу освящаемых антиминсов.	11:17	0:86	6236	rushifteval	ru
частица	NOUN	1918	1918-1990	1918-1990_частица_6237		Неприученный мозг с трудом впитывал отвлеченные идеи, -- они, как слова чужого языка, лишь частицами, искорками проникали к ее живым ощущениям.	91:100	0:143	6237	rushifteval	ru
частица	NOUN	1700	1700-1916	1700-1916_частица_6238		Заметно также, что когда часть сродства многоатомного элемента, и особенно углерода, потреблена, а другие условия не изменились, то остающаяся часть сродства оказывает напряжение, отличное от первоначального; таким образом, напр., результаты, вероятно, не всегда будут одинаковы для двух случаев, из которых в одном, положим, двуатомная частица А соединяется сначала с одноатомным веществом В и потом -- с таким же веществом С, а в другом -- та же частица А входит в соединение прежде с С, а потом с В. -- В самом деле, не все четыре пая водорода, связанные, в болотном газе, четырьмя единицами углеродного сродства, замещаются одинаково легко.	337:344	0:644	6238	rushifteval	ru
частица	NOUN	1918	1918-1990	1918-1990_частица_6239		Каждый план -- частица общезаводского плюс личные обязательства, идеи, творческая инициатива, общественная работа.	15:22	0:114	6239	rushifteval	ru
частица	NOUN	1700	1700-1916	1700-1916_частица_6240		Достаточно найти новый метод исследования, новую реакцию, улучшить старый метод, достаточно найти этими способами что-нибудь отличное от прежних результатов, как рождаются радужные надежды и конституция частицы уже носится в воображении.	203:210	0:237	6240	rushifteval	ru
частица	NOUN	1918	1918-1990	1918-1990_частица_6241		"Конечно, жена Гасилова не догадывалась о том, что Столетов мог услышать в телефоне ее диктующий голос, но она, если бы дала себе труд подумать, если бы на секунду потеряла вальяжность, могла бы сообразить, что ее наглая ложь позволяла Прохорову получать правдивые сведения, так как ему надо было только отнимать отовсюду частицу ""не""."	322:329	0:334	6241	rushifteval	ru
частица	NOUN	1700	1700-1916	1700-1916_частица_6242		Пыли, как частицам, отделившимся ото всего в мире.	10:18	0:50	6242	rushifteval	ru
частица	NOUN	1918	1918-1990	1918-1990_частица_6243		Эта частица не имеет ни массы покоя, ни электрического заряда и летит со скоростью света, свободно проникая через любые препятствия (чтобы долететь до Земли, ей нужно всего 8 мин.).	4:11	0:181	6243	rushifteval	ru
частица	NOUN	1700	1700-1916	1700-1916_частица_6244		Изломанные утратами всего близкого, вы опускали в отчаянии руки и проклинали эту безучастную, холодную толпу, а она, состоящая из личностей такого же развития, как вы, или проходила со своими семьями, со своими друзьями, не обращая внимания на вас, или давила вас с помощью этих семей и друзей, швыряя в вас грязью, как в лишнего человека, занимающего клочок земли и частицу богатства, отнятые у нее.	367:374	0:400	6244	rushifteval	ru
частица	NOUN	1918	1918-1990	1918-1990_частица_6245		Из отдельных пылевых частиц это тепло легко ускользало наружу и рассеивалось в пространстве.	21:27	0:92	6245	rushifteval	ru
