lemma	pos	date	grouping	identifier	description	context	indexes_target_token	indexes_target_sentence
увольнение	NOUN	1700	1700-1916	1700-1916_увольнение_5326-16		Все изложенное, как надо полагать, было причиною увольнения полковника Кононовича, ибо в имеющемся в делах Департамента полиции письме государственного преступника Белоцветова от 18 апреля 1881 г. вслед за описанием порядков, существовавших тогда на Каре, сообщается, что "Кононович подал в отставку, которую мотивировал тем, что он не может оставаться на своем посту, если его законные распоряжения будут отменяться".	49:59	0:418
увольнение	NOUN	1700	1700-1916	1700-1916_увольнение_5300-16		По увольнении от службы, Аракчеев вздумал отправиться в чужие края, где незадолго до того был принимаем с уважением как доверенный человек Александра.	3:13	0:150
увольнение	NOUN	1700	1700-1916	1700-1916_увольнение_5298-16		Тем не менее трое коренных гарденинских людей потребовали увольнения: наездник Мин Власов, кучер Василий и маточник Терентий Иваныч.	58:68	0:132
увольнение	NOUN	1700	1700-1916	1700-1916_увольнение_5324-16		Таким образом увольнение их есть ничто иное, как дань безумному политическому направленно.	14:24	0:90
увольнение	NOUN	1700	1700-1916	1700-1916_увольнение_5350-16		А у Корша я продержался не больше двух-трех месяцев, и меня отблагодарили за мою верную службу газете увольнением, как чиновники говорят, "по третьему пункту".	102:113	0:159
увольнение	NOUN	1700	1700-1916	1700-1916_увольнение_5348-16		Сын тоже слал ему известие за известием: молодой человек шел в гору и подробно уведомлял об увольнениях, перемещениях и назначениях.	92:103	0:132
увольнение	NOUN	1700	1700-1916	1700-1916_увольнение_5346-16		За неграмотность В Донской области в последнее время участились случаи увольнения полицейских чиновников за неграмотность.	71:81	0:122
увольнение	NOUN	1700	1700-1916	1700-1916_увольнение_5344-16		Если увольнение меня и генерала Шатилова и являлось следствием поданных нами прошений об увольнении от службы, то массовое увольнение всех прочих лиц без прошений одним с нами приказом, могло быть объяснено лишь желанием Главнокомандующего пресечь новый мерещившийся ему "мятеж".	5:15	0:279
увольнение	NOUN	1700	1700-1916	1700-1916_увольнение_5302-16		Гоголь вынимает из кармана загодя изготовленное на высочайшее имя прошение об увольнении от службы и подает.	78:88	0:108
увольнение	NOUN	1700	1700-1916	1700-1916_увольнение_5342-16		Напоследок, по многих письменных и словесных таких спорах, кои мне стоили великих трудностей, еще более день ото дня в состоянии моего здоровья слабее становясь, и сам уже о себе чувствовал я, что дни мои на вечер склонились и солнце от меня отдаляется, но как все разумнейшие доказывают, что познавать самого себя и обличать есть наитруднейшая работа, в чем я, мало дару имев, не мог бы собою, ежели бы Всевышний, по Своему провидению, не соизволил способами разных приключений так скоро и благополучно от тщетных сует и лестных воображений отдалиться и получить, со всемилостивейшим от императорского величества знаком милости, увольнение, как в начале сего моего журнала ясно показано. 1772 года, апреля 10 дня.	630:640	0:714
увольнение	NOUN	1700	1700-1916	1700-1916_увольнение_5338-16		Первое событие было увольнение престарелого князя Горчакова от должности министра иностранных дел, состоявшееся на Пасхе, и назначение на его место товарища его Гирса.	20:30	0:167
увольнение	NOUN	1700	1700-1916	1700-1916_увольнение_5336-16		Лихоимство же -- черной доской, черной книгою и, наконец, -- увольнением по прошению!..	61:72	0:87
увольнение	NOUN	1700	1700-1916	1700-1916_увольнение_5334-16		Я бы имел право теперь отсель выехать, ибо брался только служить здесь три года, а вот уже пошел четвертый; но так как при некоторой слабости я еще кое-как держусь, то не могу решиться требовать увольнения, покаместь не имею причины ни на что жаловаться и надеюсь, что при помощи Божией еще один год теперешнего течения дел облегчит роль тому, кто заменит меня.	195:205	0:361
увольнение	NOUN	1700	1700-1916	1700-1916_увольнение_5332-16		В России Увольнение стариков Нижний-Новгород, 13, I.	9:19	0:52
увольнение	NOUN	1700	1700-1916	1700-1916_увольнение_5330-16		Производство двух великих князей главнокомандующих в фельдмаршалы, увольнение великого князя Николая Николаевича от командования армией, вместе с его начальником штаба Непокойчицким, назначение главнокомандующим генерала Тотлебена, затем бесчисленное производство в полные генералы и в генерал-лейтенанты занимало общее внимание, так что позабыли почти о трудном нашем политическом положении и собирающихся грозных тучах.	67:77	0:421
увольнение	NOUN	1700	1700-1916	1700-1916_увольнение_5328-16		В сей крайности состояния моего принужденным нахожусь, припадая к священным стопам вашего императорского величества, всеподданнейше просить моего от службы увольнения.	156:166	0:167
увольнение	NOUN	1700	1700-1916	1700-1916_увольнение_5296-16		По ходатайству цесаревича Константина Павловича военный министр представил, еще в феврале 1829 года, о награждении чином при увольнении от службы 6-го класса Шаганова.	125:135	0:167
увольнение	NOUN	1700	1700-1916	1700-1916_увольнение_5340-16		Увольнение Миниха от военных должностей произвело неблагоприятное для правительницы впечатление и в войсках.	0:10	0:108
увольнение	NOUN	1700	1700-1916	1700-1916_увольнение_5304-16		Тетрадь, подаренная мне Иваном Афанасьевичем, чрезвычайно интересна: в ней, между прочим, заключается и реестр пьесам, игранным не только в продолжение всего сценического его поприща, то есть с эпохи прибытия его из Ярославля в Петербург, в 1752 г., до увольнения от театра в 1787, но и до того времени.	253:263	0:303
увольнение	NOUN	1700	1700-1916	1700-1916_увольнение_5354-16		Глава III Граф Буксгевден просит увольнения от звания главнокомандующего.	33:43	0:73
увольнение	NOUN	1700	1700-1916	1700-1916_увольнение_5314-16		На отдельных фабриках возможно даже массовое увольнение рабочих.	45:55	0:64
увольнение	NOUN	1700	1700-1916	1700-1916_увольнение_5312-16		За эти уступки протестанты сочли себя вправе подать Фердинанду просьбу об увольнении Валленштейна, чего требовали даже и католики; на этом пункте диссиденты впервые сошлись во мнениях.	74:84	0:184
увольнение	NOUN	1700	1700-1916	1700-1916_увольнение_5318-16		Он решил остаться на своем посту ждать своего увольнения в отставку.	46:56	0:68
увольнение	NOUN	1700	1700-1916	1700-1916_увольнение_5316-16		Товарищ мой схватил стакан, но я попросил увольнения, потому что неохотно пью пунш, да и запах родимой горелки как-то неприятно подействовал на мое обоняние.	42:52	0:157
увольнение	NOUN	1700	1700-1916	1700-1916_увольнение_5322-16		Александр притворился, что полюбил Санглена как друга, и особенно на одном бале преследовал его своими любезностями, приглашал танцевать, потчевал мороженым и т.п. Санглен, увидев, что наступил его последний час, просил увольнения от должности.	220:230	0:244
увольнение	NOUN	1700	1700-1916	1700-1916_увольнение_5310-16		Я попрошу председателя, чтобы вам при увольнении выдали жалованье за два месяца, а потом постараюсь устроить вас.	38:48	0:113
увольнение	NOUN	1700	1700-1916	1700-1916_увольнение_5320-16		[Зашел я к Загряжскому, он растрепан, в халате, отчаяние полное, плачет он" плачет жена -- жалуются оба мне, что не знают причины увольнения и спрашивают меня, не слыхал ли я чего Просили заступиться перед графом Бенкендорфом.	130:140	0:226
увольнение	NOUN	1700	1700-1916	1700-1916_увольнение_5308-16		А как только получу увольнение, то найму извозчика.	20:30	0:51
увольнение	NOUN	1700	1700-1916	1700-1916_увольнение_5352-16		Муравьев быстро и мудро прекратил мятеж в его корне: Западный край сразу закипел первыми отпрысками русской жизни, и в заключение, под давлением врагов, ставших сильнее его, он должен в том же дворце просить о своем увольнении от должности, где он усмирил целый край и возрадовал Россию.	216:226	0:287
увольнение	NOUN	1700	1700-1916	1700-1916_увольнение_5306-16		О увольнении почтоваго платежа Все пакеты и письма, которые из коллегий в провинции за его царского величества определенною печатью, також и из провинции за губернаторскою или воеводскою печатьми в коллегии (кроме иностранных государств) отправляются на почте, имеют на генеральном и на всех других почтовых дворах приняты и сохранно в надлежащие места отправлены быть безденежно.	2:12	0:380
увольнение	NOUN	1992	1992-2016	1992-2016_увольнение_5329-16		На увольнение по статье.	3:13	0:24
увольнение	NOUN	1992	1992-2016	1992-2016_увольнение_5321-16		Как стало известно из источников в ФПС, многие офицеры-управленцы действительно озабочены сейчас своей дальнейшей судьбой и ждут скорого увольнения.	137:147	0:148
увольнение	NOUN	1992	1992-2016	1992-2016_увольнение_5331-16		Погода-то уже и сейчас почти зимняя: дует холодный пронизывающий ветер, а по утрам кругом иней. 29.10.00 г. Приехала из Чечни партия на увольнение, а среди них земляк из Знаменки Щигровского района.	136:146	0:198
увольнение	NOUN	1992	1992-2016	1992-2016_увольнение_5319-16		Увольнение Анатолия Чубайса открыло перед Ясиным перспективу стать вице-премьером.	0:10	0:82
увольнение	NOUN	1992	1992-2016	1992-2016_увольнение_5333-16		С другой стороны, люди не будут вынуждены искать незаконные методы и способы увольнения из Вооруженных сил.	77:87	0:107
увольнение	NOUN	1992	1992-2016	1992-2016_увольнение_5353-16		Неиспользованный отпуск -- Можно ли по новому Трудовому кодексу просить компенсацию за несколько неиспользованных отпусков Юрий ПАВЛИЩЕВ, Москва -- Раньше, в соответствии с КЗоТом, замена отпуска денежной компенсацией допускалась только при увольнении сотрудника.	241:251	0:263
увольнение	NOUN	1992	1992-2016	1992-2016_увольнение_5335-16		Канцелярия 13-й полубригады внесла Бруно Лябасти в список кандидатов на увольнение из Иностранного легиона.	72:82	0:107
увольнение	NOUN	1992	1992-2016	1992-2016_увольнение_5317-16		Видно, Чугунов твой в кои веки прокололся: заявление об увольнении часа с два как у него лежит.	56:66	0:95
увольнение	NOUN	1992	1992-2016	1992-2016_увольнение_5337-16		В то же время увольнение чиновника такого ранга всегда чревато политическими осложнениями.	14:24	0:90
увольнение	NOUN	1992	1992-2016	1992-2016_увольнение_5327-16		Замысел о человеке и умысел о нем Какой урок вы извлекли для себя из истории с вашим увольнением из судей и последующим восстановлением Почему на вашем процессе сами юристы, принявшие присягу, лжесвидетельствовали -- Вся история изгнания меня из судейского корпуса была вполне предсказуемой.	85:96	0:291
увольнение	NOUN	1992	1992-2016	1992-2016_увольнение_5339-16		На что тот немедля подал рапорт об увольнении и был исключен в конце 91-го из списков части и уволен.	35:45	0:101
увольнение	NOUN	1992	1992-2016	1992-2016_увольнение_5303-16		Поэтому поддерживаю предложение о списании на убытки стоимости указанных автомобилей КамАЗ-55111.XXX напомнил присутствующим о принятых в то время мерах по усилению охраны материальных ценностей (увольнение сторожей XXX -- с материальным взысканием, XXX, XXX.	196:206	0:259
увольнение	NOUN	1992	1992-2016	1992-2016_увольнение_5341-16		Деньги Валерий и Евгений получили в общей сложности более чем через полгода после увольнения на пенсию.	82:92	0:103
увольнение	NOUN	1992	1992-2016	1992-2016_увольнение_5301-16		При увольнении на пенсию, как известно, сотрудникам органов внутренних дел положено выплатить выходное пособие.	4:14	0:111
увольнение	NOUN	1992	1992-2016	1992-2016_увольнение_5307-16		Меня убило то, что Народный Вожатый сразу подписал приказ о моём увольнении, не вызвав меня, не поговорив со мной!	65:75	0:114
увольнение	NOUN	1992	1992-2016	1992-2016_увольнение_5299-16		Конечно, это происходит уже не в первый раз -- и лихой коржаковский рейд на мэрию в декабре 1994-го, и увольнение лужковских "силовиков" после убийства Листьева весной 1995-го -- все это выполняло те же функции (правда, жестче, грубее).	103:113	0:236
увольнение	NOUN	1992	1992-2016	1992-2016_увольнение_5309-16		Ветераны дивизии, многие из которых после увольнения в запас и отставку проживают в городе Советске, также считают, что сдача в архив гвардейского знамени и боевых наград 17-й гвардейской кавалерийской дивизии (при переформировании ее в ноябре 1945 года) является исторической несправедливостью.	42:52	0:295
увольнение	NOUN	1992	1992-2016	1992-2016_увольнение_5325-16		В числе приоритетов по-прежнему остается решение блока социальных проблем военнослужащих, в том числе подлежащих увольнению.	113:123	0:124
увольнение	NOUN	1992	1992-2016	1992-2016_увольнение_5355-16		Это мне Гранин случайно проговорился про массовое увольнение охранников.	50:60	0:72
увольнение	NOUN	1992	1992-2016	1992-2016_увольнение_5351-16		Сегодня уже десять месяцев, как я сижу в Чечне, а по поводу увольнения никто ничего не знает.	60:70	0:93
увольнение	NOUN	1992	1992-2016	1992-2016_увольнение_5323-16		На приеме во французском посольстве Ваксберг мне сказал, что завтра вечером подпишут приказ об увольнении Любимова.	95:105	0:115
увольнение	NOUN	1992	1992-2016	1992-2016_увольнение_5349-16		Да Суза чуть круче, чем нужно, переложил штурвал, расходясь с моторным сампаном, увешанным гроздьями матросов в увольнении.	112:122	0:123
увольнение	NOUN	1992	1992-2016	1992-2016_увольнение_5311-16		Но в субботу и воскресенье надо было получить увольнительную, а с двойками и тройками в увольнение не пускали.	88:98	0:110
увольнение	NOUN	1992	1992-2016	1992-2016_увольнение_5347-16		А потом, недели через две или три после увольнения, резко сдало здоровье.	40:50	0:73
увольнение	NOUN	1992	1992-2016	1992-2016_увольнение_5345-16		Все догадывались о действительной подоплеке этого увольнения.	50:60	0:61
увольнение	NOUN	1992	1992-2016	1992-2016_увольнение_5313-16		Например, Continental Airlines сообщила об увольнении 12 000 из 56 000 сотрудников.	43:53	0:83
увольнение	NOUN	1992	1992-2016	1992-2016_увольнение_5343-16		-- Мы хотим всего-навсего узнать, что это за история с его увольнением.	59:70	0:71
увольнение	NOUN	1992	1992-2016	1992-2016_увольнение_5305-16		Он должен быть осуществлен до конца года и завершится увольнением главы BP Тони Хэйуорда.	54:65	0:89
увольнение	NOUN	1992	1992-2016	1992-2016_увольнение_5315-16		Страну время от времени сострясали классовые баталии -- массовые увольнения, забастовки, локауты, демонстрации, марши протеста и т. п., -- однако в правовом и социальном государстве, в сложноструктурированном гражданском обществе они никогда не доходили до крайних форм выражения и не ставили под вопрос ни общественное устройство, ни принцип социального партнерства.	65:75	0:367
увольнение	NOUN	1992	1992-2016	1992-2016_увольнение_5297-16		Саша приняла из его рук свою армейскую книжку и предписание об увольнении ее в запас.	63:73	0:85
