lemma	pos	date	grouping	identifier	description	context	indexes_target_token	indexes_target_sentence	identifier_system	project	lang
крушение	NOUN	1918	1918-1990	1918-1990_крушение_2168		Немного выше места крушения лодки В.М. Савича с левой стороны есть водопад, который называется Сагена.	19:27	0:102	2168	rushifteval	ru
крушение	NOUN	1992	1992-2016	1992-2016_крушение_2169		Однако период политической нестабильности, связанной с крушением старых институтов и отсутствием новых, когда на смену традиционным монархиям приходят молодые демократии, а их, в свою очередь, сменяют авторитарные режимы, может растянуться на века.	55:64	0:248	2169	rushifteval	ru
крушение	NOUN	1918	1918-1990	1918-1990_крушение_2170		Франк Гольдер, причем пароход, перевозивший ее, потерпел крушение, и мне пришлось продать ее Stanford University, California, чтобы уплатить премию и кое-что выручить.	57:65	0:167	2170	rushifteval	ru
крушение	NOUN	1992	1992-2016	1992-2016_крушение_2171		После этого радость палестинской улицы в день крушения нью-йоркских небоскребов, так возмутившая мировую общественность, не кажется столь уж непостижимой.	46:54	0:154	2171	rushifteval	ru
крушение	NOUN	1918	1918-1990	1918-1990_крушение_2172		Наиболее острым методом антисоветской подрывной деятельности японо-германских диверсантов на нашем железнодорожном транспорте является организация аварий и крушений.	156:164	0:165	2172	rushifteval	ru
крушение	NOUN	1992	1992-2016	1992-2016_крушение_2173		Крушение партийной карьеры.	0:8	0:27	2173	rushifteval	ru
